Cílios Y Lakanaku - Volume Brasileiro Mix E Tamanho Único:89 dias:1000:R$ 37,90:true:gold
Cílios Nagaraku Y Mix E Tamanho Único Volume Brasileiro:37 dias:500:R$ 34,40:true:platinum
50 Pares Protetor Pálpebra Gel Patch Pad Alongamento Cílios:26 dias:50:R$ 27,97:true:lider
Cílios Nagaraku Premium Mix (7a15) Volume-russo - Fio A Fio:48 dias:100:R$ 27,38:true:lider
Kit 3 Pinças Multicor Extensão De Cílios Volume Russo Top:61 dias:100:R$ 37,72:true:gold
Cílios Fadvan Fio Y Volume Brasileiro Extensão De Cílios Y:61 dias:1000:R$ 35,19:true:lider
Cílios Nagaraku Yy Volume Brasileiro - C D 0.05:54 dias:100:R$ 29,90:true:platinum
Espuma Soft Snow Kel Padilha Cherry Lash 120ml:32 dias:100:R$ 64,90:true:platinum
Cola Profissional Para Tufo Hair Bonding Glue Salon Pro 30ml:70 dias:100:R$ 28,70:true:gold
Cílios Nagaraku Fio A Fio - 0.07d Todos Os Tamanhos:62 dias:500:R$ 26,99:true:platinum
Cílios Fadvan 6d W Tecnológico Volume Brasileiro Egípcio Mix:78 dias:100:R$ 63,39:true:gold
Kit 4 Pinças Multicor Extensão De Cílios Volume Russo E Mega:48 dias:100:R$ 49,01:true:lider
Cílios Y Nagaraku Volume Brasileiro - Yy Tamanho Único | Mix:67 dias:100:R$ 35,90:true:lider
Fita Lifting 600un Pálpebras Jovens Firmes Sem Cirurgia:69 dias:100:R$ 89,91:false:lider
Palp Lifting 600un Pálpebras Jovens Firmes E Sem Cirurgia:5 dias:5:R$ 89,91:false:lider
Passo 2 Individual Master Lash Lifting Brown Lamination:4 dias:5:R$ 189,99:false:lider
Soft Snow Cherry Lash Espuma Mousse Shampoo De Limpeza:29 dias:50:R$ 64,90:true:gold
Fita De Silicone Gel Para Extensão Cílios Pele Sensível 25mm:71 dias:100:R$ 27,40:true:platinum
Pinça Extensão De Cílios Ponta Curva Multicor Alta Precisão:71 dias:100:R$ 21,90:true:gold
Escovinha Para Cilios E Sobrancelha Gliter Descártavel 50uni:41 dias:50:R$ 12,97:true:lider
Removedor Nagaraku Creme Para Cola Extensão De Cílios 5gr:90 dias:100:R$ 31,27:true:platinum
Cílios Nagaraku Fio A Fio E Volume Russo Curvatura C | D:49 dias:100:R$ 26,90:true:lider
Cola Hair Bonding Glue Cílios Tufos 30ml + Cílios Em Tela:70 dias:100:R$ 59,00:true:gold
Volante Interativo Infantil Motorista Brinquedo Musical Som:56 dias:100:R$ 46,11:true:gold
Volante Musical Grande Colorido Brinquedo Infantil Com Som:47 dias:100:R$ 31,99:false:lider
Kit Jogo 4 Alicates Utilidades Universal Corte Eletricista:39 dias:50:R$ 64,90:false:gold
Cachimbo Pipe De Metal Pipe Squadafum Original:50 dias:50:R$ 49,90:false:none
Cílios 5d W Decemars Volume Egípcio Alongamento Cilio 0.07 D:50 dias:100:R$ 52,90:true:gold
Cilios W Decemars 6d Curva D Mix 8-14 Egipcio:42 dias:50:R$ 55,97:true:lider
Cílios Decemars W 8d New 2.0 Mix E Tamanho Único:25 dias:50:R$ 72,59:true:none
Cílios 4d W Decemars Volume Egípcio Alongamento De Cílios:54 dias:100:R$ 50,07:true:gold
Cilios Nagaraku Volume Brasileiro Cilio 0.07 D Yy Original:49 dias:100:R$ 31,98:true:gold
Kit 12 Unidades Tufos Cílios De Pote Tufinho Alongamento:48 dias:100:R$ 53,99:true:lider
Cílios Decemars Y Mix E Tamanho Único - Volume Brasileiro Yy:85 dias:500:R$ 36,09:true:gold
Cílios Arison Lashes Volume Brasileiro Mix Yy 007 D Original:14 dias:50:R$ 30,36:true:platinum
Cílios Fadvan Em W 8d Mix E Individual Volume Egípcio Brasil:79 dias:100:R$ 66,30:true:lider
Cílios Fadvan Y 0.07 D Volume Brasileiro - Tamanho Único:41 dias:100:R$ 37,90:true:lider
Cílios 5d W Decemars Volume Egípcio Alongamento De Cílios:61 dias:100:R$ 60,11:true:gold
Kit Completo Iniciante Para Extensão De Cílios Lash:39 dias:50:R$ 130,64:false:none
Cilios Decemars 5d W 007 Curvatura D 8-14 Egipcio:69 dias:100:R$ 49,97:false:lider
Cílios Y Decemars Volume Brasileiro Yy - 0.07 D | Mix 8-12mm:50 dias:100:R$ 29,99:true:platinum
Cilios Decemars 8d-w New 2.0 Tamanho Único E Mix:29 dias:50:R$ 78,90:true:platinum
Cílios Decemars W 8d Mix E Tamanho Único - Volume Egípcio:25 dias:50:R$ 72,59:true:none
Kit C/10 Disco Lixa Velcro 180mm 7-8 Furos -escolha O Grão:40 dias:100:R$ 31,30:false:lider
Nabnab Garten Of Banban Cap 3 Blue Pelucia Jumbo Boneco 50cm:85 dias:100:R$ 49,90:true:gold
3 Pelúcias Baby Shark 20cm Antialérgico Super Macio Musical:67 dias:100:R$ 108,23:true:platinum
Chaves De Catraca Soquete - Chave Allen Kit C/ 46 peças nybc:69 dias:500:R$ 49,82:true:none
Kit Jogo 115 Chaves Precisão Celular Fenda Phillips Torx Y:60 dias:500:R$ 47,40:true:gold
Jogo De Soquete Aço Crv 1/4 Catraca Chave Allen C/ Maleta:50 dias:100:R$ 42,52:false:none
Kit Jogo Chaves Inglesa Boca Ajustável Regulagem Universal:88 dias:100:R$ 74,95:true:platinum
Jogo De Soquetes Cachimbos De 1/2 32 Peças Com Chave De Vela:42 dias:100:R$ 175,00:true:platinum
Kit Jogo De Ferramentas 165 Peças Aço Maleta + Parafusadeira:55 dias:100:R$ 148,00:true:none
Jogo De Soquete 1/2 Simila Gedore 108pc Aço Crv Profissiona:40 dias:100:R$ 339,99:false:platinum
Kit Jogo De Soquete Aço 1/2 E 1/4 Catraca Chave Com Maleta:32 dias:100:R$ 338,00:true:none
Kit De Chaves Virgens 275 Yales Tools:1 dias:1:R$ 247,50:false:platinum
Kit Chaves Jogo Catraca Reversível Soquetes 46 Peças Maleta:63 dias:500:R$ 46,13:true:lider
Jogo Soquete Aço Crv 1/4 Catraca Chave Allen Maleta 46 Peças:54 dias:100:R$ 45,90:true:none
Oxímetro Digital Portátil De Dedo De Pulso Led G-tech:78 dias:500:R$ 99,71:true:none
Medidor Rosa Usb:2 dias:2:R$ 99,99:false:gold
Oxímetro De Dedo Digital Medidor Saturaçao Uso Doméstico:22 dias:25:R$ 38,08:true:none
Kit Oximetro Digital Prime Pulso C/ Medidor De Pressão Gtech:76 dias:100:R$ 237,40:true:none
Kit Medidor De Glicose Gtech Lite C/ Oximetro Digital Prime:77 dias:100:R$ 141,55:true:none
Molde Carimbo Olho De Gato Delineado Gatinho Maquiagem:90 dias:100:R$ 14,71:true:gold
Tapete Almofada De Água Inflável Bebê Criança Fundo Do Mar:51 dias:100:R$ 52,30:true:lider
Tapete Interativo Térmico Tatame Infantil Educativo P/ Bebê:64 dias:100:R$ 26,90:true:platinum
Tapete Tatame Infantil Emborrachado Atividades Bebê Portátil:47 dias:100:R$ 50,49:true:lider
Tapete De Atividades Infantil Grosso Macio Térmico Dobrável:42 dias:50:R$ 149,00:true:platinum
Tapete Tatame Infantil Emborrachado Dobrável Dupla Face 6mm:71 dias:100:R$ 169,00:true:gold
Tapete De Atividades Ginásio C/ Piano Musical Castela Brasil:18 dias:25:R$ 78,97:false:none
Tapete Tatame Infantil Emborrachado Dupla Face Bebe Dobravel:32 dias:50:R$ 167,92:true:platinum
Jogo Mini Chaves Precisão Multiuso Kit Ferramentas 115 Peças:42 dias:50:R$ 43,48:true:lider
Mini Ferramentas De Precisão Jogo De Chaves 31 In 1 Philips:86 dias:100:R$ 15,90:true:lider
Kit Jogo Chave De Fenda Phillips 4 Peças Imantada Magnética:34 dias:50:R$ 35,99:true:platinum
Kit 60 Chaves Ferramenta Precisão P/ Celular Tablet Note:1 dias:2:R$ 47,40:false:none
Chave Precisão Torx Fenda Y Abrir Celular Manutenção 115 Peç:1 dias:1:R$ 79,99:false:none
Fritadeira Airfryer Philips Walita 1400w 4,1l Antiaderente:55 dias:100:R$ 500,65:true:none
Fritadeira Elétrica Air Fryer Gaabor 4l Digital Touch 127v:28 dias:50:R$ 339,00:false:platinum
Fritadeira Elétrica Air Fryer Sem Óleo 1800 Watts:64 dias:500:R$ 288,03:false:platinum
Airfryer Electrolux Eaf10 Efficient 3,2l 1400w Preta 110v:64 dias:100:R$ 424,90:true:none
Fritadeira Air Fry Forno Oven 12litros Bfr2100 Britânia:19 dias:25:R$ 895,00:true:none
Jogo De Ferramentas Titanium Maleta Com 11 Peças - 06816:40 dias:100:R$ 29,90:true:none
Kit Ferramenta P/retornar Êmbolo Da Pinça De Freio Promoção:49 dias:50:R$ 210,00:false:gold
Fritadeira Elétrica Quadrada Inox Profissional 1 Cuba 5l:62 dias:100:R$ 288,00:true:platinum
Fritadeira Elétrica 5 Lts C Escorredor De Fritura Conjugado:61 dias:100:R$ 329,99:false:none
Fritadeira Air Fryer Mondial Afn-50 5l Preta E Inox 127v:19 dias:50:R$ 469,90:false:platinum
Fritadeira Industrial Elétrica Tacho 5 Litros Redondo Inox:38 dias:100:R$ 189,95:false:none
Fritadeira Elétrica Industrial Tacho 5l Inox Profissional:24 dias:25:R$ 177,90:false:none
Fritadeira Elétrica Redonda Industrial Inox Profissional 5l:69 dias:100:R$ 224,10:true:platinum
Serum Niraj Fortalecedor De Crescimento Cilios 8ml:42 dias:50:R$ 43,97:true:platinum
Pincel De Rímel Loreal Double Extend Beauty Tubes 575:65 dias:100:R$ 139,00:false:lider
Gás Butano Para Maçarico Isqueiro Refil 300ml Lata Premium:46 dias:100:R$ 25,30:false:lider
Gás Zengaz Butano Puro 300ml 7x Refinado Isqueiro Maçarico:60 dias:100:R$ 25,99:false:lider
Pad P/ Pintura Recorte E Acabamento C/ Cabo Ajustável Atlas:56 dias:100:R$ 44,69:true:platinum
Relógio De Parede Grande Led Digital P/ Academia Hospital:85 dias:1000:R$ 117,66:true:none
Relógio De Parede Grande Led Digital P/ Academia Hospital:67 dias:100:R$ 109,19:true:platinum
Relógio De Parede Grande Led Digital P/ Academia Hospital:68 dias:100:R$ 94,72:false:lider
Relógio De Parede Grande Led Digital P/ Academia Hospital:34 dias:100:R$ 96,80:false:none
Relógio Parede Grande Led Digital P/academia Hospital Alarme:13 dias:25:R$ 107,99:true:platinum
Chupeta Alimentadora Mordedor Bebê De Silicone Porta Fruta:57 dias:100:R$ 15,57:true:lider
Chave De Impacto 38v 1/2'' Bateria Brushless:86 dias:500:R$ 599,90:false:platinum
Chave De Impacto A Bateria Reversível 1/2 20v Profissional:47 dias:100:R$ 398,77:true:none
Chave Impacto Ferramenta Furadeira Parafusadeira 2 Baterias:41 dias:100:R$ 689,90:true:gold
Chave Impacto 18v 300kgf Ws2382 K2 Wesco Maleta 2 Baterias:89 dias:100:R$ 989,89:false:platinum
Parafusadeira Chave De Impacto A Bateria 38v C/ 2 Baterias!:27 dias:50:R$ 485,00:false:none
Chave De Impacto Elétrica Duas Bateria Kit Sem Fio 48v 1/2:88 dias:100:R$ 761,67:true:gold
Chave De Impacto Bateria Brushless 38v Profissional:68 dias:100:R$ 575,90:false:lider
Ferramenta Chave Saca Extrator Retentor Universal Regulável:49 dias:50:R$ 49,99:true:platinum
Bt Lacebrow Máscara Para Sobrancelhas Bruna Tavares 2,5g:1 dias:3:R$ 51,90:false:none
Maçarico Isqueiro Mini Portátil Recarregável Com Regulagem:41 dias:100:R$ 26,97:true:none
Chupeta Rose Personalizada Menina Com Prendedor:53 dias:100:R$ 42,99:false:none
Chupeta Avent Ultra Air Periodo 0-6m Meses Philips Branca:42 dias:50:R$ 38,69:true:platinum
Chupeta Avent Ultra Air Dupla 0-6 Meses Lisa Branco Bege:43 dias:50:R$ 63,99:true:platinum
Mixer Power Inox Elgin 3 Em 1 600w 127v:36 dias:100:R$ 189,90:true:none
Mini Mixer 2 Em 1 Eletrico Misturador De Bebida Espuma Leite:83 dias:100:R$ 39,50:true:platinum
Mixer Mini Processador Liquidificador Portátil 300ml C/ Copo:33 dias:100:R$ 98,54:false:lider
Mixer Batedor Oster Fpsthb2615 Deligh 250w Turbo Processador:4 dias:4:R$ 279,23:false:platinum
Mini Mixer 2 Em 1 Eletrico Misturador De Bebida Espuma Leite:49 dias:50:R$ 47,51:true:gold
Cartela De Ovos Plástica Bandeja 30 Ovos Higiênica 06 Unid:67 dias:100:R$ 33,90:false:gold
Pote Antiaderente Para Fazer Ovos Cup Cozidos Conjunto Cup 6:1 dias:2:R$ 63,51:false:gold
Pote Antiaderente Para Fazer Ovos Cup Cozidos Conjunto Cup 6:1 dias:1:R$ 63,51:false:platinum
Máquina De Fazer Acessórios De Cozinha Ovos Cozido Sem Casca:4 dias:4:R$ 63,56:false:gold
Relógio De Mesa De Ponteiro À Pilha Branco Envio Imediato:39 dias:50:R$ 16,99:true:none
Relógio Analógico Retro Com Alarme:34 dias:50:R$ 35,54:true:lider
Relógio Despertador Digital Alto De Mesa Calendário Chronos:33 dias:50:R$ 35,05:true:lider
Relógio Digital Led De Mesa E Parede Com Data E Alarme:32 dias:100:R$ 39,13:true:lider
Carvão De Coco Para Narguile Fumax Premium Hexagonal 1kg:74 dias:100:R$ 33,80:false:lider
Papel Alumínio Magic Embalagem Nova Narguile- 50 Folhas:80 dias:100:R$ 16,90:true:gold
Carvão Para Narguile De Coco Zomo Hexagonal 1kg:12 dias:25:R$ 31,00:false:platinum
Carvão De Coco Para Narguile Fumax Premium Hexagonal 1kg:27 dias:50:R$ 29,89:false:none
Carvão De Coco Para Narguile Zomo Hexagonal 1kg - 4 Caixas:22 dias:25:R$ 119,99:false:lider
Carvão Arra Premium Para Narguile 100% De Coco Hexagonal 1kg:2 dias:3:R$ 22,74:false:none
Carvão Sense Premium Para Narguile 100% Coco Hexagonal 1kg:2 dias:3:R$ 17,13:false:none
Carvão Fumax Premium Para Narguile 100% Coco Hexagonal 1kg:2 dias:3:R$ 20,00:false:none
Kit Isopor Macaco Chave De Roda Estepe Onix 52134090 (1072):5 dias:5:R$ 180,00:false:none
Mordedor De Água Gelado Com Massageador De Gengiva Para Bebe:49 dias:50:R$ 26,47:true:lider
Mordedor Bebê Banana 4 Meses Massageador Gengiva Macio Buba:46 dias:50:R$ 27,50:true:lider
Colar Mordedor Sensorial Silicone Autismo Ansiedade*promoção:14 dias:100:R$ 20,49:true:lider
Mordedor Biscoito Colar Sensorial P/ Autistas Ansiedade Tdah:19 dias:25:R$ 23,65:false:gold
Paleta De Sombra Cinderella 18 Cores Febella Makeup:74 dias:100:R$ 45,00:true:gold
Massa Acrilica 25kg Uso Externo Parede E Tetos:90 dias:100:R$ 97,89:false:platinum
Massa Plástica Ica 800g Branca Com Catalisador:4 dias:4:R$ 18,90:false:none
Massa Acrílica 25kg | Áreas Interna E Externas:90 dias:100:R$ 99,85:false:platinum
Massa Pva Corrida Eucatex Balde 25kg:84 dias:100:R$ 78,99:false:none
Vaso Para Narguile Md Hookah Grande 30cm Promoção:56 dias:100:R$ 158,90:false:lider
Kit C/4 Refil + Maçarico Portátil Com Regulagem Gourmet:65 dias:100:R$ 89,90:false:gold
Torno De Bancada Morsa Giratória Com Bigorna N8:35 dias:50:R$ 368,08:false:none
Maçarico Portátil Para Solda + 4 Spray Refil De Gás Butano:62 dias:100:R$ 78,90:false:gold
Maçarico Portátil Para Solda + 2 Spray Refil De Gás Butano:83 dias:100:R$ 59,90:false:gold
20 Potes 500ml Marmita Fitness Reutilizável Para Microondas:77 dias:500:R$ 48,90:false:gold
Kit 10 Potes 500ml Transparentes Freezer Microondas Marmita:77 dias:100:R$ 29,90:false:gold
Kit C/24 Potes De Vidro Belem 240ml C/ Tampas E Lacres:76 dias:100:R$ 78,00:false:gold
10 Potes 500ml Marmita Fitness Reutilizável Para Microondas:83 dias:500:R$ 29,90:false:gold
Kit Primer Desengordurante + Finalizador Pro - Cherry Lash:25 dias:25:R$ 89,90:false:lider
Forninho Narguile Acendedor Panelinha Carvão 110/220 Volts:1 dias:1:R$ 29,97:false:none
Cinta Para Aneis De Pistao Montagem Automotivo Carro E Motos:82 dias:100:R$ 45,00:true:platinum
Chuveiro De Emergência Com Lava-olhos Segurança:27 dias:50:R$ 582,90:false:lider
Corpo De Apoio Tarucel 10mm - Rolo C/ 100 Metros:46 dias:50:R$ 52,99:false:lider
Macarico Automatico Profissional + Refil Map + Brinde:81 dias:100:R$ 239,99:false:platinum
Plantadeira Perna Grilo Bico Fino - Fuzil:22 dias:1000:R$ 73,45:false:none
Flangeador Excêntrico C/ Limita Torque Cortador E Escareador:84 dias:100:R$ 227,90:true:gold
Fluído De Corte Lubrificante Para Metais 500ml Machão Total:75 dias:100:R$ 46,98:false:lider
Pintura Emborrachada Bautech 20kg Escolha A Cor.:52 dias:100:R$ 329,00:false:platinum
Quartzolit Tinta Acrílica Toque Fino Premium 18l:77 dias:100:R$ 299,90:false:platinum
Tinta Acrílica Suvinil Parede Fosco Branca 18 Litros:1 dias:1:R$ 454,38:false:gold
Almofadas + Mocho + Maca 60 P/ Estética Rosa Pink Sem Juros:1 dias:1:R$ 1.499,00:false:gold
Cilindro De Massa Malta Lâmina Mirela 28cm:74 dias:100:R$ 119,90:false:platinum
Máquina Macarrão Manual Cilindro Inox Massa Caseira Manivela:46 dias:50:R$ 74,95:true:platinum
Copo Térmico 473ml Com Tampa E Abridor Para Cerveja E Chopp:81 dias:500:R$ 26,29:true:lider
Copo Térmico Cerveja Personalizado C/ Tampa E Abridor 473ml:88 dias:100:R$ 54,90:false:none
Copo Térmico 473ml Com Tampa E Abridor Para Cerveja Bebidas:47 dias:100:R$ 29,86:true:platinum
Copo Térmico Para Cerveja Café Chá Chopp 473 Ml Com Tampa:81 dias:100:R$ 26,29:false:lider
Copo Térmico Personalizado A Laser Do Seu Time Do Coraçâo:60 dias:100:R$ 79,90:false:lider
Copo Térmico 473ml Com Tampa E Abridor Para Cerveja Bebidas:47 dias:1000:R$ 26,99:false:platinum
Smartwatch W68+ Ultra Series 8 Nfc Tela 2,02 Lancamento Novo:36 dias:100:R$ 179,13:true:platinum
Relógio Smartwatch D20 Face Insta Whats Bluetooth Troca Foto:80 dias:1000:R$ 39,55:true:platinum
Relógio Smartwatch Ultra Series 8 49mm Nfc Frete Grátis+ Nf:77 dias:500:R$ 132,50:true:gold
Smartwatch W68+ Ultra Series 8 Nfc Tela 2,02 Lancamento Novo:89 dias:500:R$ 199,99:true:platinum
Relógio Smartwatch U9 Ultra Series 9 Lançamento Nfc Gps:80 dias:100:R$ 218,27:true:gold
Relógio Smartwatch W59 Pro Serie9 Nfc 47mm Original Novo Gps:56 dias:100:R$ 207,87:true:platinum
Smart Watch W68 Ultra Serie 8 Nfc Tela 2,0 Max 49mm Original:38 dias:100:R$ 178,11:true:lider
Relógio Smartwatch W69 Ultra Series 9 Android Ios Amoled Nfc:25 dias:100:R$ 244,17:true:platinum
Smartwatch W68+ Ultra Series 8 Nfc Tela 2,02 Lancamento Novo:70 dias:100:R$ 172,58:true:platinum
Smartwatch Relógio D20 Bluetooth Troca Foto Face Insta Whats:48 dias:100:R$ 39,55:true:platinum
Smartwatch Ultra 9 Serie 9 49mm Gps Nfc Lançamento + Brindes:43 dias:100:R$ 215,55:true:gold
Relógio Digital D20 Inteligente Smartwatch Y68 Android Ios:68 dias:500:R$ 29,90:false:lider
Smartwatch Ultra 9 Max Series 9 2023 Novo Nfc + 2 Pulseiras:62 dias:100:R$ 253,49:false:platinum
Relógio Xiaomi Mi Band 7 Global C/3 Pulseira + 1 Película:74 dias:100:R$ 284,99:false:gold
Relógio Smartwatch Amazfit Gts 4 Mini 1.65 A2176 - Original:24 dias:100:R$ 528,00:false:none
Smartwatch Amazfit Gts 4 Mini 1.65 A2176 Midnight - Original:36 dias:100:R$ 498,00:false:none
Smartwatch Ultra 9 Max Series 9 Modelo 2023 Original+brinde:55 dias:100:R$ 247,79:true:gold
Relógio Inteligente Smartwatch Amazfit Bip 3 Original 1,69:4 dias:5:R$ 273,00:false:none
Mi Band 8 Relógio Pulseira Original - Pronta Entrega:17 dias:25:R$ 245,00:false:none
Relógio Smart Watch W68 Ultra Series 8 Android Ios Microwear:70 dias:100:R$ 189,97:true:lider
Smartwatch Xiaomi Redmi Watch 3 Active Global 1.83 + Nf-e:10 dias:25:R$ 394,20:false:lider
Relógio Smartwatch Haylou Solar Plus Fitness 1.4 - Original:22 dias:25:R$ 288,81:false:none
Kit Relogio Inteligente Smartwatch D20 + Fone S/fio 5.0 Nfe:89 dias:500:R$ 104,93:true:platinum
Smartwatch Ultra 9 Max Series - Leitor De Glicemia No Sangue:85 dias:100:R$ 325,00:false:none
Relógio Smartwatch Original Amazfit Bip 3 Pro Versão Global:25 dias:25:R$ 335,19:false:none
Relógio Smartwatch Inteligente Digital T900 Ultra Serie 8:24 dias:50:R$ 149,99:true:gold
Smartwatch Haylou Watch 2 Pro Bt 5.3 Tela De 1.85 Pol. Azul:74 dias:100:R$ 197,66:false:none
Relógio Smartwatch Ultra Series 8 Tela Plus+ Nfc Pro Digital:20 dias:100:R$ 149,99:true:platinum
Smartwatch Inteligente Haylou Watch 2 Pro (ls02 Pro):28 dias:50:R$ 185,32:false:none
Relógio Inteligente Smartwatch Hw68 Ultra Mini 41mm Gps:65 dias:100:R$ 232,27:true:platinum
Smartwatch Inteligente Ultra Serie 8 Kd99 Original:2 dias:2:R$ 71,90:false:none
Relógio Smartwatch P80 Duas Pulseiras Feminino:41 dias:50:R$ 69,90:false:lider
Relógio Smartwatch Digital Smartband M7 Masculino E Feminino:54 dias:100:R$ 46,97:true:gold
Relógio Smartwatch Hw9 Ultramax Series 9 Amoled Nfc Original:5 dias:5:R$ 236,22:false:platinum
Smartwatch Ultra 9 Max Series 9 Modelo 2023 Original:46 dias:100:R$ 215,80:true:platinum
Smartwatch Ultra Max W69 Série 10 Nfc Amoled 2 Giga Original:2 dias:4:R$ 303,97:false:none
Relógio Infantil Inteligente Q12 Smartwatch Lbs Camera Sos:24 dias:50:R$ 78,99:true:gold
Relógio Smartwatch W26 Troca Pulseira Homem E Mulher:46 dias:50:R$ 78,99:true:gold
Relógio Xiaomi Mi Band 8 Original Lançamento 2023 + Nf-e:33 dias:50:R$ 289,90:false:gold
72 Adesivos Fita P/ Levantar Olhos Caídos Pálpebra Caídas LG:35 dias:100:R$ 21,45:true:none
Kit Brow Lamination We Bella By Lu Boscarato:9 dias:25:R$ 269,90:false:lider
Cola Para Glitter Ruby Rose Hb 580 Stay Fix 15ml:29 dias:50:R$ 24,44:true:platinum
Transformador Unik Kavo:1 dias:2:R$ 399,00:false:lider
Maquina Waffle Elétrica 110v Compacta Profissional Mini:36 dias:100:R$ 128,99:true:gold
Máquina De Fazer Waffles Elétrico Profissional Antiaderente:78 dias:100:R$ 127,30:true:platinum
Garrafa Térmica Aço Inox Personalizada Led Digital 500ml:77 dias:1000:R$ 47,90:false:gold
Garrafa Térmica Café Chá Com Termometro Digital Nórdica 1l:3 dias:5:R$ 99,90:false:platinum
Garrafa Inox Terere Chimarrão 2,5 Lts Kit Com Copo Bomba:85 dias:100:R$ 279,00:false:lider
Garrafa Térmica Led Display Inox Termômetro Portátil 500ml:54 dias:1000:R$ 24,79:false:platinum
Garrafa Térmica Digital Em Aço Inox Com Termometro - Água:28 dias:500:R$ 25,89:true:gold
Garrafa Térmica Café Chá Com Termometro Digital Nórdica 1l:22 dias:25:R$ 99,90:true:platinum
Kit Garrafa Térmica Vacuum Flask Set 500ml Com 3 Xícaras:50 dias:500:R$ 36,99:false:none
Garrafa Térmica Café Chá 1 L Cabo Madeira Temperatura Preta:1 dias:1:R$ 78,90:false:none
Garrafinha Que Sede Estampada Floral Beleza Branco Farm:18 dias:50:R$ 119,00:false:none
Garrafa Térmica Com Medidor De Temperatura Digital Led 500ml:70 dias:500:R$ 26,09:false:platinum
Garrafa Térmica Inox Agua E Café Digital 500ml Várias Cores:27 dias:500:R$ 19,90:false:none
2x Ventosas Duplas 80-90kg Vidros Pisos Porcelanatos Pesados:32 dias:50:R$ 104,99:true:platinum
Ventosa De Sucção Á Vácuo Pra Piso Com Maleta Profissional:19 dias:25:R$ 222,00:false:none
Controlador De Calor Estilo Kaloud Prata:85 dias:100:R$ 27,80:false:none
Colônia Mamãe E Bebê Natura - Tradicional (100 Ml):81 dias:100:R$ 45,90:false:none
Kit 7 Organizador Multiuso Modular Gavetas Acrílico Cristal:64 dias:100:R$ 46,50:true:gold
Organizador De Maquiagem Cosméticos Rotatório 360º Acrílico:69 dias:100:R$ 74,90:true:platinum
Tinta Borracha Líquida Soluçao Total Decor Color Lata 18l:49 dias:100:R$ 799,90:false:lider
Vedapren Parede Impermeabilizante Branco 18kg Vedacit:36 dias:100:R$ 324,70:false:lider
Tinta Emborrachada 100% Elástica - Bautech 20kg Novidade:3 dias:5:R$ 319,20:false:platinum
Pintura Emborrachada Bautech 20kg:53 dias:500:R$ 359,91:false:platinum
Selador Acrílico Interno Externo Alto Rendimento Bautech 18l:46 dias:100:R$ 78,90:false:platinum
Super Manta Liquida Laje Quartzolit Branca 12kg Transitável:76 dias:100:R$ 289,99:false:lider
Vedapren Parede Impermeabilizante Branco 18kg Vedacit:36 dias:100:R$ 324,70:false:lider
Ultra Pintura Emborrachada Bautech 20kg Cores:31 dias:100:R$ 358,70:false:platinum
Vedapren Parede Impermeabilizante Branco 18kg Original:21 dias:50:R$ 323,70:false:lider
Cortina Líquida Lt Shiner Privacidade De Vidro Fosco 250ml:27 dias:100:R$ 139,00:false:none
Vedapren Preto Manta Líquida À Base Asfalto - Galão 18 L:20 dias:50:R$ 355,91:false:none
Selador Acrilico Alto Rendimento Bautech 18l (int/ext):6 dias:25:R$ 117,94:false:platinum
Vedapren Impermeabilizante Parede 18 Kg:1 dias:5:R$ 297,50:false:platinum
Tinta Borracha Liquida Bautech 20kg Cores (emborrachada):31 dias:50:R$ 327,51:false:platinum
Tinta Emborrachada 100% Elástica - Bautech 20kg:52 dias:100:R$ 359,91:false:platinum
Tinta Borracha Líquida Solução Total Decor Colors Branco Top:74 dias:100:R$ 799,92:false:platinum
Manta Líquida Emborrachada Impermeabilizante Garin 18kg:48 dias:100:R$ 249,99:false:platinum
Kit 02 Super Manta Liquida Quartzolit Lajes E Telhados 24kg:4 dias:4:R$ 539,99:false:lider
Tinta Emborrachada Decor Colors 3,6l - Várias Cores E Branco:84 dias:100:R$ 204,90:false:platinum
Tinta Borracha Líquida Emborrachada Decor Colors Branca 18l:74 dias:100:R$ 799,90:false:platinum
Impermeabilizante Para Rodapé Bautech Mofo Umidade 4kg:21 dias:25:R$ 78,90:false:platinum
Ultra Pintura Emborrachada Bautech 4kg Cores:37 dias:50:R$ 113,90:false:platinum
Ultra Tinta Impermeabilizante Imperparede Bautech 20kg Cores:31 dias:50:R$ 341,90:false:platinum
Cortina Líquida Lt Shiner Privacidade De Vidro Fosco 900ml:25 dias:25:R$ 298,80:false:none
Manta Liquida 18l Lajes E Telhados Primer Emulsão Asfáltica:43 dias:50:R$ 168,54:false:none
Tinta Emborrachada Vedação Anti Fissuras Decor Colors Oferta:74 dias:100:R$ 209,90:false:platinum
Textura Cristallo Toque De Cristal Maza Balde 23kg:71 dias:100:R$ 204,89:false:lider
Tinta Econômica Eucatex Peg Pinte Sem Cheiro 18l - Cores:32 dias:100:R$ 209,00:false:none
Tinta Emborrachada Decor Colors 3,6l - Várias Cores E Preto:82 dias:100:R$ 209,90:false:platinum
Manta Líquida Emborrachada Impermeabilizante Dryko 18l:1 dias:2:R$ 189,90:false:none
Manta Líquida Emborrachada Impermeabilizante 12kg Garin:5 dias:5:R$ 199,90:false:platinum
Tinta Imperparede Bautech - Semelhante Vedapren Parede!:53 dias:100:R$ 323,91:false:platinum
Tinta Pintura Emborrachada Bautech 20kg Paredes Muros Telhas:20 dias:25:R$ 329,00:false:none
Caneta Alta Rotação Zion Super Led Z100 Melhor Que Kavo Nsk:5 dias:5:R$ 399,20:false:gold
Omeleteira Elétrica 850w 2 Divisões Multilaser 110v Ou 220v:32 dias:50:R$ 125,90:true:gold
Embalagem Térmica Saco Metalizado P/ Espetinhos Lacre 200un:84 dias:100:R$ 51,15:true:platinum
Embalagem Térmica Saco Metalizado P/ Espetinhos Lacre 1000un:28 dias:50:R$ 200,00:false:none
Caneta Micro Pintura Reparo Automotiva Funilaria Funileiro:59 dias:100:R$ 109,99:true:platinum
Kit Aerógrafo + Compressor Completo 17 Pçs Bivolt Aerografia:75 dias:100:R$ 259,99:false:none
Caneta Pincel Pintura Automotiva Funilaria Micro Funileiro:59 dias:100:R$ 109,90:false:platinum
Babymed Menino Pomada Com Cheirinho Suave De Bebê 45g:63 dias:100:R$ 8,80:true:lider
Óleo Johnson's Baby Hora Do Sono 200ml:39 dias:50:R$ 34,99:false:gold
Triple Paste Pomada Para Assaduras Do Bebe Importada Eua:1 dias:1:R$ 283,95:false:lider
Bb Cream Latika Fps 44 30ml:70 dias:100:R$ 75,80:true:lider
Base Líquida Niina Secrets Hidra Glow - 30ml:90 dias:500:R$ 73,05:true:platinum
Base Fluida Skin Tint Efeito Natural - Ruby Kisses:89 dias:100:R$ 51,20:true:platinum
Pó Translúcido Playboy Photo Microparticula Efeito Matte 16g:67 dias:100:R$ 14,35:true:lider
Base Matte Líquida Phallebeauty:42 dias:100:R$ 29,99:true:gold
Base Glow Essence Bioaqua Cream Para Todos Tons De Pele:34 dias:50:R$ 109,90:false:platinum
