Kit 2 Máscara Veneza 50 Tons Veneziana Baile De Máscara Fest:81 dias:100:R$ 24,95:false:platinum
1 Máscara Teatro Fantasia Jabbawockeez Dança Carnaval Festa:48 dias:50:R$ 19,50:true:platinum
Faca De Inox 12 Peças Jogo De Facas Bar/restaurante Buffet:90 dias:100:R$ 42,65:false:gold
Jogo De Facas 9pç Aço Inox Com Suporte Em Acrílico Kunsion:36 dias:50:R$ 188,30:true:lider
Kit Jogo De Facas De Churrasco Antiaderente Fio De Navalha:75 dias:100:R$ 128,10:false:lider
Jogo De Facas Kit 6 Peças Para Chef Cozinha Inox Antiaderent:37 dias:50:R$ 78,90:true:gold
Faca: Brinquedo Infantil De Madeira Montessori, Frutas E Veg:1 dias:1:R$ 138,80:false:lider
Jogo Completo 24 Peças Colher Faca Garfo Luxor Simples 123:88 dias:100:R$ 37,71:true:platinum
Conjunto De Talheres De Aço Luxo Inoxidável 20pcs Faqueiros:47 dias:100:R$ 74,86:true:none
Jogo 48 Talheres Garfo Faca Aço Inox Cabo Plástico Faqueiro:1 dias:1:R$ 92,65:false:lider
Spray Glitter Para Cabelo E Corpo Brilho Intenso - Prata:62 dias:100:R$ 22,90:false:platinum
Estola Pluma Da Noiva E Debutante Diversas Cores:42 dias:50:R$ 38,99:false:none
Grande Cozinha Completa Com Torneira Sai Água De Verdade:41 dias:50:R$ 137,90:true:lider
Grande Cozinha Infantil Completa Sai Água Mini Fogão Forno:53 dias:100:R$ 129,90:true:gold
Kit 180m² Perfis Para Forros Modular/removível 625x625mm:1 dias:1:R$ 5.202,00:false:none
Relógio De Ponto Biométrico Impressão Digital Eletrônico Pt:20 dias:50:R$ 128,30:false:none
Relógio Ponto Facial Biométrico Impressão Digital Eletrônico:5 dias:5:R$ 375,00:false:platinum
Relógio De Ponto Biométrico Impressão Digital Eletrônico Pt:20 dias:25:R$ 139,99:false:platinum
Colar Pisca E Anel Pisca Led 20 Unid Vários Modelos Colorido:84 dias:100:R$ 69,90:true:platinum
10 Colar Pisca Neon Led Festa Casamento Formatura Balada:74 dias:100:R$ 39,55:true:platinum
Carregador Bateria Dji Spark:1 dias:5:R$ 165,00:false:none
Kit C/6 Pastilhas De Vidro Ecologico 30x30 Chumbo A:1 dias:1:R$ 150,00:false:lider
Kit Com 4 Pastilha De Vidro 30x30 A021 Rose 2,5x2,5:1 dias:1:R$ 51,98:false:lider
Kit 8 Azulejos Personalizados 20x20 - Área Do Churrasco:1 dias:1:R$ 223,20:false:none
Pastilha Atlas Artico M 6249 - 5x5 Art Glass Revestimentos:41 dias:100:R$ 19,90:false:none
Kit Acessórios Frozen Elsa Com Varinha Luvas Trança E Coroa:80 dias:100:R$ 24,17:true:platinum
Fantasia Tiara Trança Da Vandinha Addams Maozinha:55 dias:100:R$ 21,83:true:gold
Kit 10 Tijolos Bloco Vidro Transparente Op 19x19x8 Tradestar:14 dias:25:R$ 199,90:false:gold
Bloco De Vidro Incolor Ondulado 19x19x8cm 1 Unidades:41 dias:100:R$ 26,90:false:none
Kit 20 Tijolos Bloco De Vidro Transp Liso 19x19x8 Tradestar:20 dias:25:R$ 409,90:false:gold
Kit 8 Tijolos Bloco Vidro Transparente Op 19x19x8 Tradestar:41 dias:50:R$ 179,90:false:gold
Kit 6 Tijolos Bloco Vidro Transparente Quadriculado 19x19x8:39 dias:50:R$ 139,90:false:gold
Kit 10 Panos De Prato Com Estampas No Atacado 100% Algodão:78 dias:100:R$ 25,90:true:platinum
Pano De Copa Prato Atoalhado Felpudo Estampas Dohler Cozinha:89 dias:100:R$ 54,99:true:platinum
Pano De Prato Preto Moderno Minimalista Gourmet 10 Uni:75 dias:100:R$ 64,90:false:lider
Pano De Prato Branco Copa Panos De Cozinha 30 Unidades:84 dias:100:R$ 74,95:false:gold
Pano Prato Atoalhado 100% Algodão Felpudo Macio Grande 20 Pç:77 dias:100:R$ 190,87:true:lider
10 Panos De Prato Estampados No Atacado:74 dias:100:R$ 28,49:true:platinum
Óculos Led Neon Festa Balada Cosplay Rave Casamento:68 dias:100:R$ 38,90:true:platinum
Kit 10 Óculos Escuro New Wave Standard Wf Quadrado Festa:65 dias:100:R$ 64,99:true:gold
Kit 10 Óculos Barbie Festas Eventos Despedidas:41 dias:50:R$ 69,90:false:gold
Kit 10 Óculos Festas Retro Preto Tik Tok + Caneta Giz Branco:85 dias:100:R$ 71,90:false:gold
Kit 2 Óculos Casal Casamento Noivo Noiva Escrito Na Lente:5 dias:5:R$ 51,99:false:none
Óculos Led Festa Neon Balada Formatura Aniversario Casamento:49 dias:50:R$ 34,53:true:gold
Bandeja Suspensão Traseira Direita New Civic 1.8 2007 A 2011:1 dias:1:R$ 650,00:false:none
Cantoneira L Canto De Parede 15mm X 15mm - Barra De 2 Metros:84 dias:100:R$ 27,45:false:lider
50 Unidades Balão Bubble 24 Polegadas 60cm Transparente Top!:31 dias:500:R$ 69,51:true:platinum
50 Unidades Balão Bubble 18 Polegadas 45cm Transparente Top!:31 dias:100:R$ 58,56:true:platinum
111 Balões D'água Bexiga Guerra Enche Fácil Gincana Festa:50 dias:100:R$ 19,49:false:lider
50 Unidades Balão Bubble 10 Polegadas 22cm Transparente Top!:31 dias:100:R$ 34,11:true:platinum
Afiador Amolador De Facas Profissional 3 Em 1:89 dias:100:R$ 19,90:true:platinum
Amolador Afiador De Facas 3 Opções De Afiar Profissional:49 dias:50:R$ 16,11:true:none
Amolador Afiador De Facas Em Aço Inox Com 3 Afiadores:89 dias:100:R$ 17,00:true:lider
Maza Verniz Pu Para Piso Kit 3,6l:46 dias:50:R$ 278,46:false:platinum
Tinta Epóxi Para Pisos De Banheiros E Cozinhas 900ml:68 dias:100:R$ 78,90:false:none
Kit Deck Modular 50cmx50cm Com 5 Placas Madeira Decks Alves:1 dias:1:R$ 187,90:false:none
Tinta Anti Mofo Clássica Suvinil Clássica 800ml Rosé:1 dias:1:R$ 77,95:false:none
Bomba Elétrica Inflador Encher Balões Bexigas Festa Rosa:54 dias:100:R$ 109,10:true:platinum
Inflador Compressor Eletrico P/ Encher Balao Bexiga 2 Bicos:67 dias:100:R$ 121,90:true:platinum
Inflador Bexiga 2 Bicos Compressor Eletrico P/ Encher Balao:67 dias:100:R$ 127,90:true:platinum
Máquina De Encher Balão Elétrica P/ Festas 2 Bicos 110/220v:14 dias:25:R$ 131,49:false:lider
Inflador Bexiga 2 Bicos Compressor Eletrico P/ Encher Balao:69 dias:100:R$ 119,90:false:platinum
Inflador Compressor Eletrico P/ Encher Balao Bexiga 2 Bicos:69 dias:100:R$ 74,99:false:none
Inflador Compressor Eletrico P/ Encher Balao Bexiga 2 Bicos:69 dias:100:R$ 74,99:false:none
Inflador Elétrico Balão Bexiga Bomba 2 Bicos Festa Rosa 220v:49 dias:50:R$ 78,90:false:none
Papel De Parede Adesivo Ripado Madeira 10m X 45cm Lavável:83 dias:1000:R$ 68,29:true:none
Papel De Parede Madeira Adesivo Ripado 10 Metros Lavável 3d:49 dias:1000:R$ 63,42:true:gold
Papel De Parede Madeira Adesivo Ripado 10m X 45cm Lavável 3d:77 dias:1000:R$ 66,79:true:platinum
Cabo Tipo C Para Controle Drone Fimi X8 Se:4 dias:5:R$ 59,90:false:none
Fragmentadora De Papel E Cartão Multilaser 10l 127v Of009:83 dias:100:R$ 289,01:true:none
Mini Lanchonete Hamburgueria Fast Food Infantil Brinquedo:1 dias:1:R$ 236,00:false:none
Máquina De Fechar Pastel Caseiro Molde Portátil Pequena:5 dias:5:R$ 36,99:false:none
Cadeira Iso Mr Longarina Polipropileno 4 Lugares Preta:21 dias:25:R$ 396,05:false:gold
Kit Prenda Lembrança Pega Varetas Mola Maluca Io-io Pintinho:1 dias:1:R$ 209,98:false:platinum
Cadeiras De Escritorio Giratoria Com Bracos Nr 17, Luxo:24 dias:100:R$ 319,98:false:platinum
Cadeira De Escritorio Com Base Cromada Prizi Venice - Branca:29 dias:100:R$ 229,90:false:platinum
Cadeira Escritório Basic Diretor Tela Mesh Preta:57 dias:100:R$ 229,00:false:lider
Cadeira De Escritório Giratória Alta Luxo Aro:67 dias:100:R$ 298,71:false:platinum
Conjunto Kit Cadeira De Escritório Presidente Eames V331:25 dias:25:R$ 1.599,99:false:platinum
Cadeira Mocho Dentista, Estética, Tatoo Promoção Fabrica:86 dias:100:R$ 251,91:false:platinum
Cadeira De Escritório Presidente Big Pl-101 Com Molas 150kg:11 dias:25:R$ 765,00:false:gold
Cadeira Brizza Back System Tela Braço Regulavel Aero Preto:1 dias:1:R$ 1.011,00:false:lider
Cadeira Florença Presidente Esteirinha Estofada Couro:87 dias:100:R$ 518,45:false:gold
Drones Profissionals Câmeras E88 Fotografia Aérea 2 Baterias:34 dias:100:R$ 257,45:true:platinum
Drone Hk9 Câmera 4k Uhd Vídeo Profissional 2.4ghz No Brasil:18 dias:25:R$ 493,96:true:platinum
Drone Tesla 5000m 3 Camera Dual 50x De Zoom 4k Profissional:41 dias:100:R$ 389,00:false:none
Piso Vinílico Autocolante Madeira Carvalho 5m² Lvt (36 Un):21 dias:25:R$ 479,90:true:platinum
Piso Vinilico Autocolante Régua Madeira Cinza 2,5m² (18 Un.):31 dias:50:R$ 199,90:false:platinum
Piso Vinílico Autocolante Régua M²:50 dias:100:R$ 77,90:false:gold
Bandeirinha Junina De Plástico C/100 Metros Festa Junina:87 dias:100:R$ 51,00:false:platinum
Faixa Dia Dos Pais Decorativa Bandeirinha Decoração 1,8m Nf:46 dias:100:R$ 22,56:false:platinum
13 Flâmulas Personalizada 45x64 Cm:1 dias:1:R$ 390,00:false:gold
Mesa De Estudos Escritório Home Office Gaveta Computador Top:62 dias:100:R$ 199,80:false:lider
Escrivaninha Mesa Office Estudo Estilo Industrial Star:77 dias:1000:R$ 249,74:false:platinum
Kit Mesa Gamer Para Computador C/ Gaveteiro Multiuso:1 dias:1:R$ 378,93:false:none
Mesa Computador Escrivaninha Notebook Gamer Preta E Vermelho:58 dias:100:R$ 185,99:false:none
Escrivaninha Computador Estudo Escritório Estilo Industrial:1 dias:2:R$ 187,19:false:gold
Mesa Escrivaninha Estudo Industrial Computador Notebook Pc:12 dias:100:R$ 216,25:false:platinum
Escrivaninha Gamer Para Gabinete Para Computador Com Espaço:62 dias:100:R$ 160,93:false:none
Escrivaninha Mesa 90cm X 60cm Estudo Home Office Retrro:74 dias:100:R$ 222,69:false:platinum
Escrivaninha Industrial Em Para Trabalho Estudos - Madeira:61 dias:100:R$ 212,29:false:none
Mesa Computador Note Estudo Escrivaninha Penteadeira Pequena:62 dias:500:R$ 131,06:false:platinum
Mesa Gamer C/ Espaço Para 2 Monitores Compacta Industrial:42 dias:100:R$ 156,87:false:none
Escrivaninha Mesa Estudo Computador Notebook Pequena V/b:76 dias:100:R$ 135,93:false:platinum
Mesinha Computador Multiuso Quarto Sala Escritório - Cores:27 dias:100:R$ 147,59:false:none
Mesa Escrivaninha Em Madeira Maciça Para Escritório Notebook:57 dias:100:R$ 215,28:false:none
Máquina Tranca Magica Cabelo Infantil Para Menina Terere:39 dias:100:R$ 78,90:true:platinum
Brinquedo Kitdentista Infantil Didático Criançamenina Menino:1 dias:1:R$ 49,99:false:gold
Máquina Mágica De Trança Terere Para Cabelo Infantil Menina:23 dias:25:R$ 65,82:false:none
Kit Cabelo Colorido Trança Terere Maquina Infantil Com Nf:40 dias:50:R$ 86,99:true:gold
Kit Cubos Grande Baby 30x30x30 Mdf Cru Cha Revelação:41 dias:50:R$ 68,89:false:gold
Cubos Baby 30x30cm Mdf Cru Promoção Decoração De Festa:89 dias:100:R$ 72,99:false:none
Cubo Baby Pintado Decoração Chá De Bebê E Revelação Mdf 30cm:24 dias:25:R$ 113,10:false:lider
Cubo Baby Pintado Decoração Chá De Bebê E Revelação Mdf 30cm:27 dias:50:R$ 77,10:false:lider
22 Enfeites De Mesa Personalizado 15 Anos -14cm- Mdf Branco:1 dias:1:R$ 71,50:false:lider
Xiaomi Mi Tv Stick Mdz-24-aa Full Hd 8gb 1gb Ram:64 dias:100:R$ 279,00:false:gold
Xiaomi Mi Tv Box S 2ª Geração 4k Mdz-28-aa Google Tv:89 dias:100:R$ 409,00:false:gold
Conversor Smart Tv Box 8gb De Ram 128gb Pro 4k - Android 11:7 dias:50:R$ 184,00:false:none
Amazon Fire Tv Stick 3ª Geração Alexa 8gb:50 dias:50:R$ 269,00:false:lider
Smart Tv Box Aquario - Homologado Anatel - Netflix Youtube:85 dias:100:R$ 224,99:true:platinum
Xiaomi Mi Tv Stick Português Controle Voz Full Hd 8gb:19 dias:50:R$ 299,00:false:gold
Inova Tv Box 4k Dig-7021 Padrão 4k 32gb Preto Com Memória:18 dias:100:R$ 124,99:false:platinum
Tv Box Aparelho Android Com Play Store Frete Grátis Promoção:27 dias:100:R$ 221,99:true:none
Smart Tv Box Aquario - Homologado Anatel - Netflix Youtube:85 dias:100:R$ 219,99:true:gold
Smart Box Tv Transforme Sua Tv Tubo, Lcd, Led Em Smart Tvbox:25 dias:100:R$ 249,99:false:none
Conversor Smart Tv Box 8gb De Ram 128gb Pro 4k - Android 11:29 dias:100:R$ 174,89:false:lider
Amazon Fire Tv Stick Lite Edición 2022 Full Hd 8gb Preto:24 dias:25:R$ 261,00:false:none
Tv Box Aparelho Android Converta Sua Tv Em Smart 4k Promoção:66 dias:500:R$ 229,49:false:none
Tv Box Aparelho Android Converta Sua Tv Em Smart Promoção:14 dias:25:R$ 149,99:false:none
Xiaomi Mi Tv Stick Mdz-24-aa De Voz Full Hd 8gb Preto:41 dias:50:R$ 305,00:false:gold
Tv Box Aparelho Android Converta Sua Tv Em Smart Promoção:5 dias:5:R$ 129,90:false:none
Amazon Max Fire Tv Stick 4k Max Ultra 3 Geração Original +nf:32 dias:50:R$ 407,55:false:lider
3ª Geração Full Hd Carvão For Google:46 dias:100:R$ 103,80:false:none
Xiaomi Mi Tv Stick 4k 1080p Android 11 8gb E 2ram Original:21 dias:25:R$ 398,05:false:lider
Inova Tv Box 4k Dig-7021 Padrão 4k 32gb Preto Com Memória:54 dias:100:R$ 122,00:false:none
Amazon Fire Tv Stick Terceira Geração Controle De Voz Alexa:17 dias:50:R$ 269,90:false:none
Aparelho Transforma Tv Comum Em Smart Tv Box Séries Filmes C:11 dias:25:R$ 189,90:false:none
Aparelho Transforma Tv Comum Em Smart Tv - Envio Rápido:1 dias:1:R$ 139,90:false:none
Visualizador Vitalício 1gb 8gb S1:4 dias:4:R$ 449,00:false:none
Jarra Polipropileno Branca 3l C/ Escala Alto Relevo -bremen:1 dias:2:R$ 52,90:false:gold
Kit Jarras Medidoras 500ml E 1l + Copinho Medidor 100ml:1 dias:1:R$ 32,01:false:lider
24m² Assoalho 3cm Tratado Autoclave Pinus - Maringá Madeiras:1 dias:1:R$ 3.075,62:false:none
Vela Aniversário Faísca Estrelinha Dourada 4 Unidades:40 dias:50:R$ 14,90:true:lider
Vela De Aniversário Redonda Dupla Face Festa Donuts - C/1:1 dias:1:R$ 34,50:false:none
Karaokê Exclusivo Online E Offline 19 Mil Musicas Novidade:21 dias:25:R$ 474,05:false:none
Kit Jogo De Ferramentas Infantil Cinto Construtor + Capacete:81 dias:100:R$ 39,92:true:gold
Parafusadeira E Furadeira De Brinquedo Ferramentas Infantil:77 dias:100:R$ 43,30:true:gold
3 Bandejas De Aço 58 Cm X 120 Cm:1 dias:1:R$ 357,00:false:none
Kit 3 Barras De Led Tv Philco Ph28s63d 6v Novo + N.f:48 dias:50:R$ 56,00:false:platinum
Kit Barras De Led 39ln5400 39ln5700 39la6200 39ln549c Nova:7 dias:25:R$ 78,90:false:lider
Kit 8 Barra Led 49uk6310 49uk6300 49lk5700 49lk5750psa Novo:63 dias:100:R$ 98,70:false:platinum
Kit Barra Led Tv LG 43lf6350 Compatível:70 dias:100:R$ 59,41:false:platinum
Kit Barras De Led Compatível Para Tv LG 49lj5500 49lj5550:18 dias:25:R$ 109,00:false:lider
Kit 100pç Conjunto Jogo P Cortar Queijo 4 Pçs Inox Kit Facas:1 dias:1:R$ 1.850,00:false:none
Conjunto Jogo P/ Cortar Queijo 4 Pçs Inox Kit Facas Espátula:1 dias:5:R$ 16,90:false:none
12 Cubo Gelo Led Colorido Neon Enfeites Decorar Drinks Festa:5 dias:5:R$ 29,99:false:platinum
12 Gelo Cubo Led Pisca Colorido Neon Enfeites Decorar Drinks:38 dias:50:R$ 41,90:true:lider
Kit 5 Pedras Do Poder Luccas Neto Os Aventureiros:44 dias:100:R$ 78,99:false:gold
Brinquedo Antigo Disney Molde Da Estrela:9 dias:50:R$ 299,00:false:none
Kit 2 Alto Falantes Tv Samsung Un40f6100/5200/6400/5500:71 dias:100:R$ 54,99:true:gold
Cortador Fatiador Legumes Picador Lamina Aço Alta Qualidade:74 dias:100:R$ 78,99:true:lider
Fatiador Cortador De Legumes Salada Ralador Multiuso De Inox:88 dias:100:R$ 62,29:true:platinum
Descascador De Pinhão - Pinholino O Original - Com Receitas:85 dias:100:R$ 74,00:false:lider
Cortador E Picador De Legumes Frutas Batata Palito:42 dias:50:R$ 57,10:true:gold
Processador Triturador Moedor Alimentos Manual Alho 500ml:90 dias:100:R$ 16,73:true:platinum
Cortador Max Pro Profissional Original Ralador Queijo Legume:21 dias:50:R$ 109,99:false:none
Cortador E Fatiador Mandoline Frutas Legumes Ajustável Weck:22 dias:25:R$ 59,99:false:platinum
Processador De Alimentos Manual Grande 5 Lâminas Inox 900m:35 dias:100:R$ 28,72:true:gold
Triturador Alho Manual Processador Picador Fatiador Legumes:90 dias:100:R$ 19,99:true:gold
Triturador Alho Manual Processador Picador Fatiador Legumes:21 dias:100:R$ 19,98:true:platinum
Cortador Max Pro Original Ralador Queijo Legume Profissional:21 dias:25:R$ 109,99:false:lider
Brinquedo Kit Penteadeira Infantil Princesas + Acessórios:2 dias:3:R$ 109,00:false:none
Caixa Registradora Infantil Som E Luz Glam Girls Cores Top:46 dias:50:R$ 114,99:true:gold
Base Isopor Bolo Fake 20x25x30 C/15cm Maciço + 15x20 2 Un Cd:1 dias:1:R$ 149,00:false:lider
Kit Frisado Rodapé De Poliestireno 20 Barras 10cm Altura:11 dias:25:R$ 712,80:false:platinum
Painel Ripado Decorativo Eva Autocolante 5cm - 10 Metros:27 dias:50:R$ 69,99:true:platinum
Escada Jet Ski Sea Doo - Completa:40 dias:50:R$ 999,00:false:lider
Glitter Holográfico Decoração Glitz Comestível Várias Fab:49 dias:50:R$ 20,99:false:lider
Corante Soft Gel Mago 60grs - Escolha A Cor:43 dias:100:R$ 6,99:false:none
Prateleira Em Aço Reforçado 60 Cm De Largura 5 Bandejas:21 dias:100:R$ 149,39:false:none
Estante Em Aço 5 Bandejas:46 dias:100:R$ 279,31:false:none
Estante Em Aço 5 Bandejas:46 dias:100:R$ 194,09:false:none
Ralador De Queijos Fresh Cheese Elétrico Britânia:59 dias:100:R$ 170,91:false:none
Kit Conversão De Lâmpada Ccfl Para Led Monitor 15 A 24:22 dias:25:R$ 59,90:false:lider
100 Forminhas De Doces Finos Flor Casamento Festa Brigadeiro:48 dias:50:R$ 59,75:true:gold
40 Forminhas Para Doces Finos Festa Casamento Style:24 dias:25:R$ 21,75:false:lider
Placa Principal 42pfl3604/78 42pfl3604 Com Garantia:5 dias:50:R$ 477,70:false:none
Placa Principal Samsung Un32f4200ag Bn91-10940w:25 dias:25:R$ 120,00:false:none
100 Forminhas Para Doces Finos Super Volume 4 Camadas Seda:34 dias:100:R$ 78,21:true:lider
Mini Cupula Redoma De Vidro Transparente 7,5x9,5 Cm:6 dias:25:R$ 29,17:false:gold
Mapa Brasil Brinquedo Educativo Quebra Cabeça Pedagógico:88 dias:100:R$ 21,50:true:gold
Carregador Quadruplo Lcd De Bateria 18650 16340 14500 26650:50 dias:50:R$ 69,99:true:platinum
Carregador De Pilha 9volts Modelos Aa Aaa Bateria 110v/220v:14 dias:25:R$ 32,90:true:gold
Carregador De Pilha Inteligente Lcd Digital:61 dias:100:R$ 45,80:true:platinum
Carregador De Pilhas Bateria Mox Bivolt Auto Stop Aa Aaa 9v:62 dias:100:R$ 41,90:true:platinum
Carregador + 4x Pilha Recarregável Palito Aaa + 4x Comum Aa:75 dias:100:R$ 59,00:true:platinum
Carregador De Pilhas Recarregáveis Aa/aaa Com 4 Aa Duracell:6 dias:25:R$ 172,93:false:platinum
Bateria 18650 Samsung 25r 2500 Mah Inr:68 dias:100:R$ 45,90:false:gold
Carregador + 10 Bateria Li-ion B-max Original 3.7v 18650:1 dias:1:R$ 158,25:false:lider
Carregador De Pilhas Recarregáveis Duracell Aa/aaa Com 4 Aa:18 dias:50:R$ 179,99:false:none
Carregador De Pilhas Com 4 Pilhas Aa Recarregáveis 4500mah:47 dias:50:R$ 48,86:true:platinum
4 Pilha Recarregável Aa + Carregador Rápido Bivolt:55 dias:100:R$ 57,90:true:none
Kit 4 Pilhas Aa Recarregável Led Indicador Longa Duração:50 dias:100:R$ 48,86:true:platinum
Escorredor De Macarrão Arroz Massas Legumes Em Aço Inox:63 dias:100:R$ 30,88:true:platinum
Borboleta Magica 2 Borboleta Mágica Voadora:5 dias:5:R$ 25,90:false:lider
Jogo Crocodilo Dentista Aperta Dente Morde Dedo Das Crianças:56 dias:100:R$ 22,99:true:lider
Display Barbie Kit 5 Peças Festa Decoração Centro Mesa:90 dias:100:R$ 78,80:false:lider
Fonte 12v 5a 60w Bivolt Cftv Estabilizada Universal Plug P4:79 dias:1000:R$ 21,47:true:gold
Carregador Echo Dot Alexa Bivolt De 15w - Original:17 dias:25:R$ 60,00:false:none
10 Fontes Estabilizadas 12v 3a Bivolt Pra Led Cftv Plug P4:32 dias:50:R$ 102,28:false:none
Carregador Hoverboard Fonte Scooter Eletrico Bivolt 42v:20 dias:50:R$ 36,00:false:none
Fonte 3vdc 1a Para Aquecedores A Gás 3v Eliminador De Pilhas:21 dias:50:R$ 32,76:false:none
Fonte Prova D'agua 12v-2a 110-220v Pra Camera Ip Speed Dome:57 dias:100:R$ 18,60:true:gold
Fonte De Alimentação Bancada 30v 5a Bivolt 4 Dígitos Usb:54 dias:100:R$ 499,90:true:gold
Fonte Para Fita Led Cftv Bivolt 12v 3a 5050 3528 Kit 3 Un Nf:78 dias:100:R$ 42,70:true:platinum
Fonte Para Fita Led Bivolt 12v 3a 5050 3528 Câmera Cftv 2 Un:52 dias:100:R$ 28,70:true:platinum
Jogo 12 Peças Utensílios Silicone Colher Espátula Concha:57 dias:500:R$ 103,87:true:gold
Kit Colheres Silicones 12 Peças Silicone C/ Suporte Madeira:63 dias:100:R$ 113,92:true:platinum
Kit 12 Utensílios De Cozinha Em Silicone Cabo De Madeira:50 dias:100:R$ 99,90:true:none
Kit 12 Utensílios De Cozinha Em Cabo De Madeira E Silicone:64 dias:100:R$ 113,92:true:platinum
Conjunto 15 Pçs De Cozinha De Silicone Cabo De Aço Inox:18 dias:25:R$ 149,90:true:gold
Kit 12 Utensílios Silicone Cozinha Cabo De Madeira C/balde:12 dias:25:R$ 86,71:true:platinum
Kit 12 Utensílios De Cozinha Em Silicone E Cabo De Madeira:75 dias:100:R$ 78,99:true:platinum
Kit C/12 Utensílios De Cozinha Silicone Cabo Madeira:50 dias:100:R$ 98,48:true:gold
Kit 12 Utensílios De Cozinha Em Silicone E Cabo De Madeira:70 dias:100:R$ 73,13:true:lider
Kit 12 Utensílios De Cozinha Em Silicone E Cabo De Madeira:56 dias:100:R$ 99,46:true:platinum
Pegador De Massa Lyor Ópera De Aço Inox Champanhe E Branco:1 dias:1:R$ 33,90:false:none
Kit Utensílios Cozinha Talher Silicone 12 Peças Cabo Madeira:35 dias:100:R$ 99,90:false:lider
Jogo 12 Peças Utensílios Silicone Colher Espátula Concha:50 dias:50:R$ 93,90:false:none
Jogo Kit C/12 Peças Utensílios De Cozinha Colheres Espatulas:20 dias:50:R$ 74,90:false:none
Kit Utensílios Cozinha 12 Peças Silicone:40 dias:100:R$ 73,44:false:none
Kit C/12 Utensílios De Cozinha Silicone Cabo Madeira:40 dias:50:R$ 78,90:false:none
Kit Colheres Silicones 12 Peças Silicone Cabo Madeira:49 dias:100:R$ 86,89:false:none
Kit 12 Peças De Cozinha Silicone Cabo Madeira Frete Grátis:88 dias:100:R$ 108,67:true:platinum
Kit C/12 Utensílios Cozinha Silicone Cabo Madeira Resistente:72 dias:100:R$ 77,00:false:lider
Kit 12 Utensílios De Cozinha Silicone Cabo Madeira Alimentos:23 dias:25:R$ 76,90:true:lider
Kit 12 Colheres De Silicone Utensilios Cozinha Cabo Madeira:53 dias:100:R$ 78,84:true:gold
Kit 12 Utensílios De Cozinha Em Silicone Concha Espátula:53 dias:100:R$ 99,94:false:lider
Kit Colheres Silicone Utensílios Cozinha Cabo Madeira:28 dias:100:R$ 98,72:true:lider
Suporte Organizador De Documento Papel A4 3 Bandejas Com Nfe:73 dias:100:R$ 76,00:true:lider
Porta Caneta Lapis Treco Clips Papel Aramado Preto Telado:56 dias:100:R$ 20,42:false:gold
Pistola Metralhadora Bolha De Sabão Máquina Sopro Automática:42 dias:50:R$ 19,70:true:gold
Bolhas De Sabão Pistola Arma Brinquedo Lança Bazuca Criança:41 dias:50:R$ 41,68:true:none
Kit C/ 4 Bastões Lança Bolhas De Sabão Gigantes E Divertidos:84 dias:100:R$ 23,65:true:lider
Kit 6 Peças Brinquedo Lança Bolhas De Sabão Arminha De Bolha:1 dias:1:R$ 215,90:false:platinum
Arco Desmontável De Ferro Redondo Painel P/ Festas E Eventos:12 dias:25:R$ 132,00:false:gold
Painel Festa Redondo Flamengo Sublimado C/elástico 1,50diam:90 dias:100:R$ 59,96:false:platinum
Trio Capas Cilindros + Painel Sublimado Arraiá Veste Fácil:84 dias:100:R$ 78,20:false:platinum
Arco Desmontável Em Ferro Redondo Painel P/ Festas E Eventos:12 dias:50:R$ 132,00:false:gold
100un Baterias Cr2032 2032 3v Sony / Murata:90 dias:100:R$ 279,90:false:lider
50 Baterias Pilha Cr2032 Elgin - 10 Cartelas:88 dias:100:R$ 79,90:false:none
Baterias 7ah 12v Elgin Cerca Elétrica Alarme Nobreak:39 dias:100:R$ 86,90:false:lider
Cr2450 Bateria Lithium 3v 500ma - Cartela 5 Pçs:25 dias:100:R$ 18,99:false:gold
Bateria 9 Volts Recarregável Por Usb 500ma Li-ion 1000 Ciclo:67 dias:100:R$ 68,90:false:gold
Bateria 6v 4,5ah Recarregável Moto Elétrica Carro C/frete *:85 dias:100:R$ 79,19:false:lider
Kit 10 Bolas Futebol De Vinil Cordão Mola Inflável Coloridas:21 dias:50:R$ 54,99:false:gold
Seca Salada Centrifuga Secador Verduras Manual Grande 4 L:34 dias:50:R$ 29,99:true:platinum
Pilha Duracell Palito Aaa + Alcalina Aa 32 Pilhas Cartelas:19 dias:25:R$ 168,80:false:gold
Cartela De Bateria Cr1620 Sony Com 5 Baterias:39 dias:50:R$ 23,65:false:none
Kit Pom Pom Metalizado 7 Pares Líder De Torcida Festa:5 dias:5:R$ 61,90:false:gold
Kit Pom Pom Metalizado 100 Pares Líder De Torcida Festa:1 dias:1:R$ 750,00:false:gold
Kit 3 Secadores Varal Massas Frescas 6 Hastes Desmontáveis:1 dias:1:R$ 70,43:false:gold
Toalha De Mesa Festa Plástico Descartável Perolizada 10 Un:39 dias:50:R$ 23,97:true:lider
Rolo De Tnt 40g - 50 Metros 1,40 De Largura:63 dias:100:R$ 71,54:false:gold
Trio Capa Cilindro C/ Elástico Festa Decoração Varias Cores:64 dias:100:R$ 61,54:false:lider
Kit Cinema 10 Balde 1,5l Pipoca + 10 Twister Colorido 500ml:47 dias:100:R$ 55,97:false:platinum
Kit Mario Bros - 1 Copos C/ Canudo + 1 Baldes Pipoca:1 dias:1:R$ 35,60:false:platinum
20 Balde De Pipoca Azul Liso 1,5l Lembrancinhas Baldinho Pip:85 dias:100:R$ 40,84:true:gold
Kit 15 Cinema Baldinho Pop Pipoca 1 L + Copo Twister 500ml:5 dias:5:R$ 53,68:false:gold
30 Baldinhos Para Pipoca 1 Litro Cineminha Lembrancinha:27 dias:50:R$ 50,73:false:gold
Balde P/ Pipoca Com Estampa Do Stitch 2,1 L:1 dias:1:R$ 24,99:false:none
Kit10 Baldinho Praia Festa Brinde Lembrancinha Aniversário:77 dias:100:R$ 68,76:false:platinum
Kit 40 Baldinhos De Praia Para Diversão Da Criança Colorido:1 dias:1:R$ 206,50:false:none
Kit 12 Formas Silicone Mini Cupcake Bolo Muffin Assadeira:71 dias:500:R$ 20,09:true:gold
Adaptador De Fogão De Indução Difusor Conversor 2023:5 dias:5:R$ 101,16:false:none
Forma De Picolé Sorvete Silicone Flexível 4 Partes + Palitos:29 dias:50:R$ 44,16:true:gold
Copo Americano Red Cup Beer Pong Descartável 100 Un Vermelho:45 dias:100:R$ 64,74:true:platinum
Copo Festa Biodegradável 440ml Americano Red Cup 100 Unid:45 dias:50:R$ 63,96:true:platinum
Copo Papel Kraft 60ml Biodegradável Térmico Café 100un:37 dias:50:R$ 31,35:true:gold
230 Copos Long Drink 350ml Personalizados:1 dias:1:R$ 609,00:false:lider
2 Mini Funil Metal Perfume Aromaterapia Óleo Essencial Âmbar:83 dias:100:R$ 17,20:true:lider
Funil Plástico Bico Flexível Filtro Troca Óleo Combustível:47 dias:100:R$ 29,99:false:platinum
Guardanapo Festa Aniversário Colorido 19,5x21,cm 50 Unid:27 dias:50:R$ 9,90:false:lider
Bolha De Sabão Pistola Arma Brinquedo Lança Bazuca Criança:35 dias:50:R$ 49,92:true:platinum
Arminha Lança Agua Pistola Pressão Brinquedo Criança Arma:2 dias:2:R$ 24,51:false:gold
