Soprador Térmico Vonder Profissional Stv1500n 500° C/4 Bicos:70 dias:100:R$ 159,90:true:platinum
Soprador Térmico De Ar Quente Saq-1500w Ferrari - Abs301000:70 dias:100:R$ 109,90:false:none
Jaqueta Texx Ronin Impermeável Motoqueiro Motociclista Moto:86 dias:100:R$ 352,75:false:lider
Termostato Wk-03 - 250v 12a / 250v 16a - T6.4:88 dias:100:R$ 22,49:false:lider
Termostato Bimetálico P/ Forno Eletrico Suggar Best 300°c:1 dias:1:R$ 24,50:false:platinum
Vivo Box Modem Roteador 3g E 4g Zte Mf253 Chip Desbl:13 dias:25:R$ 419,33:false:none
15 Mil Cápsulas Gelatina Vazia:1 dias:1:R$ 480,00:false:none
Vidro Temperado Para Forno Eletrico Philco 46l E 42l:43 dias:50:R$ 130,00:false:gold
Suporte Pedestal Violão Guitarra De Chão Compacto Dobrável:71 dias:100:R$ 64,90:true:platinum
Suporte Hercules Ss700b Para Caixa Com Catraca P 45kg:1 dias:2:R$ 1.525,88:false:none
Telefone Yealink Sip - T19p E 2:67 dias:100:R$ 60,00:true:lider
Telefone Fast Ip Openstage 15 Sip Nf E Garantia 12 Meses:5 dias:5:R$ 299,00:false:none
Telefone Siemens Openstage 40sip:25 dias:25:R$ 200,00:false:none
Pasta Az Registradora Oficio Dac Com Lombo 7,5cm 04 Unidades:68 dias:100:R$ 78,90:true:platinum
10 Pastas Presilha Grampo Trilho Romeu E Julieta Dac Ofício:40 dias:50:R$ 34,99:true:platinum
Kit Reparo Microondas Capacitor 0,85uf + Diodo + Fusivel:74 dias:100:R$ 25,99:false:platinum
10 Capacitor Para Microondas Pino Grosso:5 dias:5:R$ 120,00:false:lider
Agulha Hipodermica Bd 30g 13x30 - Estética / Botox - 100un:90 dias:500:R$ 37,90:true:lider
Seringa 150ml Grande Plástico Dieta Recarga Oficina Fluidos:46 dias:50:R$ 37,58:false:lider
Seringa 3ml Luer Lock Com Agulha Fixa 30x7 Descartável:76 dias:100:R$ 39,99:true:platinum
Seringa 3ml Luer Slip + Agulha 30x7 - Caixa C/ 100 Unidades:90 dias:100:R$ 43,92:true:lider
Oculos Vr Box Realidade Virtual + Controle Filme Jogos 3d:50 dias:100:R$ 45,99:false:platinum
Óculos Vr Realidade Virtual 3d Com Fone De Ouvido E Controle:63 dias:100:R$ 224,25:false:gold
Sonda Gastrostomia 100% Silicone 12-14-16-18-20-22-24 Fr:19 dias:25:R$ 105,99:false:gold
Sonda Gastrostomia Silicone 3 Vias C/ Balão Todas Numerações:2 dias:3:R$ 78,49:false:gold
Kit Nutrição E Alimentação Enteral 60 Frs 300ml +30 Equipo:1 dias:1:R$ 145,00:false:gold
Puxador Da Porta De Microondas Nn-st369:5 dias:5:R$ 39,00:false:none
Grampeador Metal + 5000 Grampos 26/6 Galvanizados Escritório:83 dias:100:R$ 25,47:true:platinum
Grampeador 20 Folhas Metal Reforçado Preto:50 dias:50:R$ 15,74:true:lider
Corrediça Gaveta Telescópica Trilho Reforçada 50cm Par:85 dias:100:R$ 26,40:true:gold
Corrediça Gaveta Telescópica Trilho Reforçada 40cm Par:78 dias:100:R$ 22,50:true:gold
Corrediça Gaveta Telescópica Trilho Reforçada 30cm Par:78 dias:100:R$ 19,80:true:gold
Par De Corrediças De Apoio Trilho Roldana Para Gavetas 35cm:1 dias:1:R$ 25,00:false:lider
Magnetron Para Microondas M24fb-610a = M24fc-610a Galanz:20 dias:100:R$ 121,98:false:platinum
Magnetron Microondas 2m219j /2m319j Original - Várias Marcas:12 dias:100:R$ 108,90:false:platinum
Magnetron Para Microondas M24fb-610a = M24fc-610a Galanz:20 dias:100:R$ 121,98:false:gold
Magnetron Para Microondas Vários Modelos Á Escolher:55 dias:100:R$ 137,90:true:platinum
Magnetron Galanz M24fa-410a Brastemp Consul Panasonic Philco:49 dias:50:R$ 139,99:true:none
Magnetron Micro Ondas Brastemp Consul Galanz M24fa-410a + Nf:25 dias:25:R$ 134,90:false:platinum
Magnetron 2m167b-m14 Mesmo Magnetron 2m219h - Novo:12 dias:25:R$ 108,90:false:platinum
Magnetron Panasonic 2m210-m1 Para Diversos Microondas:25 dias:25:R$ 47,00:false:lider
Transformador Md-701 Amr-1 Objy2 120v/60hz:7 dias:50:R$ 40,00:false:none
Magnetron Galanz Para Microondas Cônsul Facilite Compacto:30 dias:100:R$ 45,00:false:none
Magnetron Microondas Om 75p (31) Samsung Com Garantia:23 dias:25:R$ 40,00:false:lider
Magnetron 2m219j E522 Witol Original:22 dias:50:R$ 580,00:false:lider
2m219j Magnetron Para Microondas Electrolux Mef41:27 dias:50:R$ 63,00:false:lider
Magnetron Microondas Galanz Original M24fb-210a Com Garantia:63 dias:100:R$ 40,00:false:lider
Transformador Para O Microondas Electrolux Mef28:33 dias:50:R$ 49,00:false:none
Magnetron 2m210-m62 Serve Nos Microondas Brastemp Antigos:19 dias:50:R$ 50,00:false:none
Magnetron M24fa-410a Para Microondas Consul De 20 Litros:7 dias:100:R$ 79,00:false:none
Placa De Lógica + Membrana Do Microondas Brastemp Bms25abhna:13 dias:25:R$ 89,00:false:none
Colete Refletivo Pro Tork Moto Boy:40 dias:100:R$ 48,31:false:none
Kit 10 Porta Retratos 15x21 Molduras Pretas Eucatex E Vidro:62 dias:100:R$ 101,91:false:lider
Suporte Organizador De Documento Papel A4 3 Bandejas Com Nfe:73 dias:100:R$ 76,00:true:lider
Porta Caneta Lapis Treco Clips Papel Aramado Preto Telado:56 dias:100:R$ 20,42:false:gold
2 Livros Para 1000 Fotos 10x15 Casamento Bebê Familia Tudo:51 dias:100:R$ 89,77:false:platinum
Motor Do Ventilador Microondas Eletrolux Mef28 Me21g Me21s:1 dias:1:R$ 51,29:false:platinum
Tarugo Nylon Ø 150 X 70mm Nita Plast:1 dias:1:R$ 126,00:false:none
Kit Com 10 Aparelho De Barbear Gladiator + Power Ref360:25 dias:25:R$ 11,99:true:none
Barra Apoio C/ Ventosa Para Banheiro Em U Idosos Deficientes:83 dias:100:R$ 29,98:true:platinum
Barra De Apoio Para Sanitário Articulada 60cm:5 dias:5:R$ 160,00:false:none
Barra D Apoio C/ventosa,segurança Multiuso Corrimão Portátil:82 dias:100:R$ 40,00:false:gold
Display Redondo Led Azul Microondas Philco Pme31:40 dias:50:R$ 74,90:false:gold
Display Led Azul Microondas Mec41 Mb38x Novo:69 dias:100:R$ 59,49:false:gold
Kit Violão Clássico Vogga + Capa + Correia + 3 Palhetas:1 dias:1:R$ 399,90:false:none
10 Rolos De Etiqueta Impressão Térmica Zebra Elgin 15x10cm:83 dias:100:R$ 160,64:true:platinum
Papel Sulfite A4 500 Folhas:75 dias:100:R$ 24,65:true:none
2500 Etiqueta Térmica Sem Rolo 10x15 /100x150 Formato Resma:21 dias:25:R$ 178,90:false:platinum
2500 Etiqueta Térmica Sem Rolo 10x15 /100x150 Formato Resma:81 dias:100:R$ 169,95:false:platinum
1.000 Etiqueta Térmica 10x15 /100x150 Formato Resma:19 dias:25:R$ 64,99:false:platinum
4 Rolos Etiquetas 10x15 100x150 Térmica Serrilha Zebra Elgin:50 dias:100:R$ 54,00:true:gold
1.000 Etiqueta Térmica 10x15 /100x150 Formato Resma:39 dias:100:R$ 72,85:false:none
Hastes Flexíveis Topz Caixa 75 Unidades Kit C/2 Un:40 dias:50:R$ 2,81:false:platinum
Tapete Banheiro Antiderrapante Ventosa Box Borracha:75 dias:100:R$ 41,99:false:lider
Rele Da Placa Microondas Electrolux Mep41 Mg41r Original:1 dias:1:R$ 21,99:false:platinum
Placa Logica Microondas Electrolux Mef30 Original:34 dias:50:R$ 60,00:false:lider
Placa Display Do Microondas Electrolux Mef28 110v:32 dias:50:R$ 69,00:false:none
Placa Do Micro-ondas Electrolux Mef41:29 dias:50:R$ 148,00:false:lider
Placa Do Microondas Cônsul Cms18cbhna:29 dias:50:R$ 69,00:false:none
Placa Principal Display Microondas Mef28 Mef30 127v:19 dias:100:R$ 64,90:false:lider
Placa Display Do Microondas LG Ms3042b:5 dias:5:R$ 190,00:false:none
Placa Display Mtd30 70002929 Microondas Electrolux:15 dias:50:R$ 129,90:false:none
Placa Display Do Microondas Electrolux Mef33 220v:8 dias:25:R$ 160,00:false:none
Placa Display Do Micro-ondas Electrolux Mef41 Bivolt:23 dias:25:R$ 145,00:false:none
Placa Display Do Micro-ondas Panasonic Nn St369wrun:5 dias:50:R$ 79,00:false:none
Placa Eletrônica Microondas Electrolux 20l Mtd30:1 dias:1:R$ 111,00:false:none
Placa Display Do Microondas Mef28 700001486:15 dias:25:R$ 69,00:false:none
Placa + Membrana Do Micro-ondas Electrolux Mef41:1 dias:25:R$ 140,00:false:none
Placa Display Do Microondas Electrolux Mef30 127v:3 dias:5:R$ 60,00:false:none
Plástico Do Painel Do Micro-ondas Electrolux Me27s:5 dias:5:R$ 45,00:false:none
Placa Painel Microondas Panasonic Nn-st254w (bivolt):1 dias:2:R$ 119,99:false:none
Placa Do Microondas Electrolux Me21g 110v:5 dias:5:R$ 50,00:false:none
Placa Display Microondas Electrolux Me28s 127v:1 dias:25:R$ 110,00:false:none
Placa Display Do Micro-ondas Cônsul Cma30afbna 127v:3 dias:3:R$ 199,00:false:none
Placa Display Do Microondas Brastemp Bms27:1 dias:1:R$ 120,00:false:none
Placa Display Do Microondas Consul Facilite Cma20abana:2 dias:5:R$ 150,00:false:none
Placa Display Do Micro-ondas Electrolux Me28s 70294462:3 dias:5:R$ 130,00:false:none
Apoio De Cabeça Para Banheiras 11 Preto Conforto Relaxamento:5 dias:5:R$ 35,99:false:lider
Amortecedor Pistão Porta Armário Cozinha 60n 80n 100n 2un:87 dias:100:R$ 16,90:true:none
Kit 2uni - Pistão A Gas / Abertura Pra Cima 40n (4kg):26 dias:50:R$ 21,90:false:none
Prato Do Microondas Electrolux Mt30s Mto30 24 Cm 20 Litros:4 dias:5:R$ 29,75:false:platinum
Prato Micoondas Philco Pmo21:1 dias:1:R$ 39,75:false:platinum
Prato Microondas Compativel Electrolux 20l 24cm Mto30 Mt30s:4 dias:5:R$ 29,75:false:platinum
Motor Do Prato Microondas Eletrolux Me27f 21v:12 dias:100:R$ 40,00:false:none
Cartela Bingo - 5 Blocos - Coloridas - Total 500 Fls. 8x10cm:42 dias:100:R$ 24,60:true:gold
10 Frascos Vidro Âmbar Gotejador 1ml Óleos Essenciais Antiuv:86 dias:100:R$ 31,70:true:lider
150 Frascos Conta Gotas Gotejador Vidro Âmbar 30ml P/ Floral:60 dias:100:R$ 329,40:true:gold
Frasco Plástico De 20ml Conta Gotas - 100un Com Tampa Lacre:46 dias:50:R$ 38,90:false:platinum
Frasco Plástico De 30ml Conta Gotas - 100un Com Tampa Lacre:46 dias:100:R$ 41,90:false:platinum
10 Frascos Vidro Âmbar Conta Gotas 5ml Óleos Essenciais:63 dias:100:R$ 38,70:false:lider
Frasco Vidro Âmbar 1000ml Rosca 31mm Com Tampa E Batoque:13 dias:50:R$ 33,90:false:lider
Toalheiro Térmico Duplo (aquece E Seca Toalha):78 dias:100:R$ 475,99:true:gold
Toalheiro Termico Duplo 127v Ou 220v:4 dias:50:R$ 423,99:false:gold
Toalheiro Térmico Elétrico Preto 110v/220v:4 dias:100:R$ 249,09:false:gold
Toalheiro Elétrico 110v/220v Botão On/off:4 dias:100:R$ 242,51:false:gold
Hidrocoloide Curativo 10x10 Cx Com 10 Unidades - Casex H110:75 dias:100:R$ 75,98:true:platinum
Adesivo Hidrocoloide Para Acnes E Espinhas Cremer Curativo:89 dias:100:R$ 25,00:true:lider
Esparadrapo Micropore Bege Nexcare Original 25mm X 1,35m:69 dias:100:R$ 6,63:true:platinum
Curativo De Hidrofibra Hydrocare Ag 10x10 Ref: Hp1010 Casex:75 dias:100:R$ 46,00:false:platinum
Soro Fisiológico 500ml Limpeza Nasal Ferimentos Lentes:64 dias:1000:R$ 5,91:false:platinum
Microtubo Tipo Pino Epp 0,38ml Flaconete Centrifuga 1000 Un:46 dias:50:R$ 26,90:false:platinum
Banquinho De Cócoras Pés Para Vaso Sanitário Antiderrapante:55 dias:100:R$ 47,56:true:lider
Alva Desodorante Natural Stick Cristal 100% Original 120g:66 dias:100:R$ 80,10:false:lider
Puxador Porta Inox Polido 45cm Redondo Tubular - 10 Unidades:1 dias:2:R$ 380,00:false:none
Puxador Porta Inox Polido 45cm Redondo Tubular - 20 Unidades:1 dias:2:R$ 760,00:false:none
Puxador Tubular Redondo Aço Inox Polido 45cm X 30cm:63 dias:100:R$ 45,00:false:none
Puxador Para Porta Living Dourado Fosco Zen Duplo 1000mm:1 dias:1:R$ 1.476,92:false:gold
Xbox Live Gold 3 Meses Envio Imediato - Codigo 25 Digitos:4 dias:25:R$ 59,50:false:none
Xbox Live Gold 12 Meses - 25 Dígitos - Leia A Descrição:37 dias:100:R$ 170,00:false:none
Gift Card Xbox 5 Reais Código Digital Envio Imediato:2 dias:5:R$ 12,43:false:none
Game Pass Ultimate Two Meses:3 dias:5:R$ 65,00:false:none
Game Pass Ultimate 6 Meses Live Gold+gpu Codigo 25 Digitos:26 dias:50:R$ 160,00:false:none
2 Month (meses) Game Pass Ultimate:1 dias:1:R$ 64,99:false:none
2 Mês Game Pass Ultimate:3 dias:3:R$ 79,00:false:none
Flexivel Freio 348120 Fiesta 1999 2000 Dianteiro:2 dias:2:R$ 68,74:false:none
Tanquinho Mueller 4,5kg Plus Preto - 220v:1 dias:1:R$ 849,00:false:none
Tanquinho Mueller 4,5kg Plus Branca - 220v:1 dias:1:R$ 849,00:false:none
Mini Máquina De Lavar Roupas Panos Toalhas No Balde Portátil:1 dias:1:R$ 42,83:false:none
Máquina De Lavar Brastemp 12kg Platinum Ciclo Tira Manchas:21 dias:25:R$ 2.311,09:false:none
Tanquinho/máquina De Lavar Roupas Semi-auto Colormaq 15kg:49 dias:50:R$ 613,74:false:none
Tomada 12v Usb 5v Moto Carregador Cel Isqueiro Prova De Agua:72 dias:100:R$ 38,29:true:gold
Vitro 02 Folhas De Correr 1.20 X 1.10 - Linha Suprema:1 dias:2:R$ 575,00:false:none
Vitro Capelinha 140 X60 Cm Branco Linha 25 Suprema:1 dias:1:R$ 590,00:false:none
Vitro Pivoltante 100x60 8 Vidros Linha Suprema:1 dias:1:R$ 510,00:false:none
Vitro Capelinha Horizontal 30x80 Enviamos Pra Todo Brasil:1 dias:2:R$ 260,00:false:none
Vitro Fretes Do Produto 12x14:80 dias:100:R$ 15,00:false:lider
Kit De Portinholas Abrigo Alumínio Preto Veneziana Vent:1 dias:1:R$ 2.400,00:false:none
2 Janelas Maxim Ar Alumínio Branco Com Guarnições:1 dias:1:R$ 780,00:false:none
20 Cartelas De Adesivos Fofos Kawaii Para Agendas E Planners:49 dias:50:R$ 22,70:true:lider
50 Adesivos Barbie 5x5cm Rosa:56 dias:100:R$ 14,90:false:lider
Painel Cbx 250 Twister Com Defeito Não Funciona Conta-giros:88 dias:100:R$ 159,90:true:platinum
Cesto Forrado Retangular Banheiro E Lavanderia Roupas Sujas:84 dias:100:R$ 128,45:true:gold
Cesto De Roupa Suja Dobrável Organizador 3 Compartimentos:83 dias:100:R$ 137,90:true:platinum
Cesto Organizador Brinquedo Roupa Suja Multiuso Dobrável 40l:64 dias:100:R$ 32,65:true:gold
Cesto Roupas Suja Multiuso Brinquedo Dobrável Impermeável:61 dias:100:R$ 27,51:true:gold
Cesto Para Roupas Roupeiro Organizador Rattan 50l Promoção:27 dias:100:R$ 45,90:false:none
Cesto Banheiros De Bambu Forrado Claro Retangular P/ Roupas:84 dias:100:R$ 139,90:false:platinum
Cesto De Roupas Suja Com Tampa De Normal 49l:81 dias:100:R$ 179,99:false:lider
Cesto De Roupa Organizador Multiuso Tecido Dobrável Suja:15 dias:25:R$ 29,74:false:gold
Cesto Organizador Infantil Brinquedo Roupa Impermeável 60l:63 dias:100:R$ 35,90:false:none
Cesto Roupa Suja Multiuso Brinquedo Dobrável Impermeável:61 dias:100:R$ 27,51:true:gold
Tanque De Lavar Roupa Pequeno 22l Com Gabinete Mdf Montado:84 dias:100:R$ 335,00:false:platinum
Tubo K2 Edta 5ml Com Gel Coleta A Vacuo C/50 Und - Greiner:68 dias:100:R$ 56,49:true:platinum
Tubo De Coleta 4ml Ativador De Coágulo 100un Tubo 13x75 Mm:15 dias:25:R$ 40,75:false:gold
Controle Video Game Xbox 360 Pc Com Fio Joystick Manete X360:37 dias:100:R$ 50,49:false:none
Violão Acústico Cordas De Aço 38,2 Pol Preto - Loud:48 dias:50:R$ 269,00:false:platinum
Palheta Para Persiana Integrada Udinese 1300mm:1 dias:3:R$ 59,90:false:none
Bolha Elefantré 30.0 Transparente Cristal Com Faixa Preta:1 dias:1:R$ 137,99:false:none
Skin Para Controle Xbox 360 Edição Halo 3 By Todd Mcfarlane:1 dias:1:R$ 180,00:false:none
Dispenser De Papel Higiênico Inox De Até 400 Metros Proflux:57 dias:100:R$ 116,89:false:lider
Porta Papel Toalha Compacto Dispenser Papeleira Premisse:50 dias:50:R$ 27,28:false:platinum
Combo - Porta:1 dias:1:R$ 4.829,00:false:none
Porta De Madeira De Correr Completa Frisado C/trilho 210x92:7 dias:50:R$ 200,00:false:none
Porta Sanfonada De Correr Pvc Multilit 2,10cmx0,70cm Cores:5 dias:5:R$ 49,99:false:none
2 Unidades De Creme Dental Branqueador V34 Repara Dentes E M:26 dias:100:R$ 64,20:false:platinum
Creme Dentário Branqueador Hi-smile V34/repara 2 Unidades:18 dias:100:R$ 74,25:false:lider
5 Unidades De Creme Dental Branqueador V34 Repara Dentes E M:29 dias:50:R$ 94,99:false:platinum
Creme Dentário Branqueador Smile-ease V34/repara 2 Unidades/:14 dias:50:R$ 60,59:false:none
2 Unidades De Creme Dental Branqueador Lanthome V34/repara:33 dias:50:R$ 68,71:false:lider
Creme Dentário Branqueador Hi-smile V34/repara 4 Unidades:15 dias:50:R$ 94,05:false:lider
2 Peças De Creme Dental Não Invasivo Para Tratamento Dentári:35 dias:50:R$ 74,75:false:platinum
Creme Dentário Branqueador Smile-ease V34/repara 3 Unidades:22 dias:50:R$ 83,66:false:platinum
Toothpaste-clareia Os Dentes,corrige Dentes Amarelos 2pcs:47 dias:50:R$ 70,34:false:gold
Creme Dentário Branqueador Smile-ease V34/repara 2 Unidades:22 dias:25:R$ 70,44:false:platinum
Creme Dentário Branqueador Hi-smile V34/repara 4 Unidades:15 dias:25:R$ 89,35:false:none
Fonte Xbox 360 Super Slim 1 Pino Bivolt Nova Pronta Entrega:77 dias:100:R$ 59,99:true:platinum
Bateria Carregador Controle Xbox 360 Fat Super Slim:77 dias:100:R$ 19,99:true:platinum
Fonte Compatível Xbox 360 Super Slim Bivolt 1 Pino 110/220:39 dias:100:R$ 88,96:false:gold
Colchonete Casca De Ovo Anti-escaras Solteiro D23:83 dias:100:R$ 66,49:true:gold
Colchão Pneumático Air Plus Superior 127v 220v Suporta 135kg:25 dias:25:R$ 229,41:true:platinum
Colchão Pneumático Refil Sem O Motor - Air Plus Dellamed:89 dias:100:R$ 169,00:false:none
Colchonete Anti Escaras Solteiro Espuma Casca De Ovo Cinza:42 dias:50:R$ 49,90:false:lider
Colchao Casca De Ovo Caixa De Ovo Anti-escaras Solteiro Cinz:57 dias:100:R$ 129,86:false:gold
Colchão Casca De Ovo D33 Casal Padrão Alto Suporte De Peso:41 dias:100:R$ 138,99:false:none
Talha Manual De Corrente 2 Toneladas / 3 Metros De Elevação:47 dias:50:R$ 379,23:false:gold
Escova Banheiro Inox Limpar Vaso Sanitario Limpador Privada:76 dias:100:R$ 78,90:true:none
Escovinha Sanitária Com Suporte Limpeza Banheiro Lavatina:63 dias:100:R$ 7,29:false:none
Peso Pezinho De Guidao De Moto Pcx 150 + Buchas Cromado Par:21 dias:25:R$ 36,44:true:platinum
Andaimes Modulo Tubular Aço Altura 100cm X Comprimento 150cm:57 dias:100:R$ 189,99:false:gold
Piso Prancha Metalico Plataforma P/andaimes 1,50x0,50 Dupla:2 dias:4:R$ 200,00:false:none
Suporte Para Soro Com Regulagem De Altura E Rodizio Hospital:2 dias:5:R$ 66,90:false:gold
Sensor Kinect Original Para Xbox 360 + Kinect Adventures:43 dias:50:R$ 64,89:false:none
Protetor De Carenagem Lander 250 2019 A 2023 Com Pedaleira:70 dias:100:R$ 339,00:false:platinum
Besmille Clareador Dental V34 30ml + Frete Por Conta Da Casa:26 dias:50:R$ 199,00:false:none
Besmille Clareador Dental V34 30ml Restaurador De Sorrisos:26 dias:50:R$ 199,90:false:none
Pasta De Dentes Branqueadora Smile-ease V34/repair 2 Unidade:4 dias:5:R$ 75,78:false:none
Agitador 8 Pás Lavadora Brastemp Ative 11kg Bwl11 Completo:85 dias:100:R$ 50,72:true:platinum
Estojo Escolar Organizador Box Grande Jumbo 100 Pens:19 dias:25:R$ 38,28:false:lider
Mesa Auxiliar Inox 50x40x80cm Com Rodinhas:84 dias:100:R$ 299,99:false:gold
Mesa Mayo Totalmente Em Aço Inox:1 dias:1:R$ 289,00:false:gold
Mesa Mayo Pintada Com Bandeja:1 dias:1:R$ 249,00:false:gold
Ralo De Alumínio Linear 20x100 + Aro De Fixação Inoxidável:35 dias:100:R$ 67,90:false:none
Clareador Dental 9 Unidades Whiteness Simple 22%:1 dias:5:R$ 108,90:false:platinum
Clareador Dental Whiteness Simple 22% C/3 Gel Dentes:1 dias:5:R$ 42,60:false:platinum
Whiteness Simple 16% 3 Unidades:1 dias:5:R$ 42,90:false:platinum
Clareador Dental Mini Kit Whiteness Simple 22%:1 dias:5:R$ 39,90:false:platinum
3 Seringas Clareador Dental Whiteness Class 7,5% - Fgm:1 dias:4:R$ 67,99:false:platinum
3 Seingas Clareador Dental Whiteness Class 10% - Fgm:1 dias:1:R$ 60,90:false:platinum
Kit Com 3 Seringas Whiteness Simple 22% Clareador Dental Fgm:1 dias:5:R$ 42,90:false:platinum
Kit Clareamento White Class 10% C/3 Gel + Moldeira Clareador:1 dias:3:R$ 78,90:false:platinum
12 Unidades Whiteness Simple 22%:1 dias:1:R$ 151,90:false:platinum
3 Unidades Whiteness Simple 22%:1 dias:5:R$ 40,90:false:platinum
2 Seringas Clareador Dental Whiteness Class 10% - Fgm:1 dias:2:R$ 50,90:false:platinum
9 Unidades Whiteness Simple 16%:1 dias:2:R$ 117,90:false:platinum
Clareador Dental White Class 10% Reposição - Fgm:1 dias:2:R$ 27,90:false:platinum
7 Seringas De Clareador Dental White Class 10% + Moldeira:1 dias:2:R$ 149,90:false:platinum
1 Seringa Clareador Denatl Whiteness Class 10% - Fgm:1 dias:1:R$ 29,90:false:platinum
6 Unidades Whiteness Simple 22% + 1 Par De Moldeira:1 dias:5:R$ 78,90:false:platinum
Kit Branqueamento Dental Original Whiteness Simple 22% Molde:1 dias:1:R$ 62,90:false:platinum
Clareador Dental Whiteness Simple 22% 9/seringas:1 dias:1:R$ 128,90:false:platinum
2 Seringas Clareador Dental Perfect 22% +1 Moldeira E Estojo:1 dias:2:R$ 61,90:false:platinum
6 Unidades Whiteness Simple 16% + 1 Par De Moldeira:1 dias:2:R$ 78,90:false:platinum
Kit Clareamento Dental Caseiro Whiteness Moldeira 3 Gel C/3g:14 dias:25:R$ 79,90:false:none
Creme Dental Branqueador V34 Repara Dentes E Melhora O Mar:26 dias:50:R$ 59,99:false:platinum
Clareador Dental Mini Kit Whiteness Simple 22% + Moldeira:1 dias:1:R$ 58,90:false:platinum
Clareia Os Dentes E Corrige A Pasta De Dentes Amarelos:35 dias:50:R$ 59,45:false:lider
Creme Dentário Branqueador Smile-ease V34/kit De Reparação 1:4 dias:5:R$ 58,81:false:none
3 Bisnagas Clareador Dental Whiteness Simple 16% + Moldeiras:1 dias:1:R$ 57,90:false:platinum
Whiteness Simple 22% 3 Unidades + 1 Par De Moldeira:1 dias:2:R$ 62,90:false:platinum
2 Seringas Clareador Dental Perfect 16% +1 Moldeira E Estojo:1 dias:2:R$ 59,90:false:platinum
Carrinho Carro Armazem Para Cargas 200kg:3 dias:5:R$ 299,00:false:lider
Carrinho De Carga 150kg P/ Armazém Roda Ldi + Brinde Lona:81 dias:500:R$ 267,82:false:none
Carro Dobrável Para Carga Suporta 150kg:25 dias:25:R$ 299,90:false:lider
Carrinho Carro Armazem Para Cargas 200kg Metal Livre:11 dias:25:R$ 341,91:false:lider
10 Rls Etiqueta 10x15 100x150 Térmica Serrilha Para Envios:89 dias:100:R$ 169,80:true:gold
10 Rls Etiqueta 10x15 100x150 Térmica Serrilha Para Envios:89 dias:100:R$ 159,99:false:none
Controle Xbox Classic Joystick Original:1 dias:2:R$ 399,00:false:none
4x Fixodent Original 100% 68g Kit Com 4 Tubos:63 dias:100:R$ 121,49:false:none
Creme Dental Clareador Glister Kit Com 3 De 200g Cada:11 dias:25:R$ 119,99:false:none
Corega Ultra Sem Sabor 68g Fixador Prótese:4 dias:5:R$ 45,00:false:none
Creme Dental Sem Flúor De Própolis Verde 7% 80g Apis Brasil:84 dias:100:R$ 34,80:false:gold
Bomba De Drenagem Lava Seca LG Eau61383504 220v Original:88 dias:100:R$ 71,77:true:none
Roda Carrinho Mão Aço Completa. Pneu + Aro + Câmara 3.25/8:88 dias:100:R$ 74,10:true:platinum
Carrinho Mão Carriola De Pedreiro Chapa 22 - Em Atacado:88 dias:100:R$ 260,77:false:platinum
Carrinho De Mão Reforçado Pneu E Câmara Galvanizado 55l:83 dias:100:R$ 208,81:false:platinum
Mecanismo Lavadora Electrolux Lac09 Lt09 60017222 Original:29 dias:50:R$ 247,11:true:platinum
Mecanismo Brastemp Bwk12 Bwr12 Bwk14 Consul Mini Original Nf:43 dias:50:R$ 200,28:true:platinum
Escova De Dentes Eletrica Ultra Soft Oral 6 Funções 3 Refil:49 dias:100:R$ 53,50:false:lider
Escova De Dentes Elétrica Recarregável 6 Funções 3 Refil:49 dias:100:R$ 53,50:false:lider
Chapa Aquecedora Digital - Cerâmica 30x20 - Solidsteel:1 dias:1:R$ 1.800,00:false:none
Correia Batedeira Philco Php500 W Turbo Planetária:45 dias:50:R$ 24,90:false:gold
Correia Plana De Transmissão Lisa Sem Fim 250mmx30mmx2mm:1 dias:1:R$ 45,00:false:lider
Escova Dental Premium Curaprox - Dual Love - Kit Com 02:57 dias:100:R$ 59,77:true:lider
Escova Dental Ultramacia Curaprox 5460 2 Unidades - Sortidas:28 dias:50:R$ 66,98:true:gold
Palito De Dente Bambu Natural Embalados Um A Um Caixinha Eco:48 dias:100:R$ 13,94:true:platinum
Cotovelo Para Cpap S10 Resmed:1 dias:1:R$ 70,88:false:none
Escada Resistente E Leve De Alumínio 3 Degraus P/ Até 120kg:62 dias:100:R$ 134,05:false:gold
Escada Alumínio Doméstica 5 Degraus Mor Reforçada:76 dias:500:R$ 194,92:false:none
Escada Alumínio Doméstica 4 Degraus Mor Reforçada:75 dias:500:R$ 151,33:false:none
Escada Alumínio Doméstica Mor 6 Degraus:21 dias:25:R$ 179,99:false:platinum
Escada De Alumínio 3 Degraus Tesoura Capacidade Resistente:2 dias:5:R$ 119,90:false:platinum
Escada Alumínio Doméstica 3 Degraus Reforçada Resistente Mor:27 dias:100:R$ 142,90:false:platinum
Escada Escadinha 3 Degraus Mor Resistente Aluminio 5101:28 dias:50:R$ 129,99:false:none
Escada De Alumínio Doméstica 5 Degraus Reforçada Resistente:39 dias:100:R$ 179,90:false:platinum
Escada De Alumínio Resistente 6 Degraus Antiderrapante Mor:6 dias:50:R$ 180,31:false:platinum
Escada Escadinha 02 Degraus Maca Hospitalar Aço Extra Forte:17 dias:25:R$ 131,90:false:lider
Escada Alumínio Doméstica 5 Degraus Mor:34 dias:100:R$ 189,90:false:gold
Escada De 5 Degraus Para Uso Doméstico Dobrável Ferro Aço:55 dias:100:R$ 213,65:false:gold
Escada De 7 Degraus Para Uso Doméstico Dobrável Ferro Aço:55 dias:100:R$ 284,90:false:gold
Escada Alumínio 5 Degraus Multifuncional Dobrável Reforçada:39 dias:100:R$ 175,21:false:none
Escada De Alumínio 3 Degraus Tesoura Capacidade 120 Kg Mor:36 dias:50:R$ 145,90:false:platinum
Escada 6 Degraus Alumínio Doméstica Mor Reforçada:48 dias:100:R$ 186,98:false:lider
Escada Alumínio Doméstica 5 Degraus Mor Reforçada:48 dias:100:R$ 166,98:false:lider
Escada Alumínio Doméstica 6 Degraus Reforçada Tesoura Oferta:68 dias:100:R$ 239,90:false:platinum
Escada De Alumínio Doméstica 5 Degraus Reforçada Resistente:2 dias:25:R$ 162,90:false:platinum
Escada De Alumínio Doméstica 3 Degraus Reforçada Resistente:25 dias:25:R$ 122,90:false:gold
Escada Doméstica De Alumínio 5 Degraus Mor Tesoura 120 Kg:26 dias:100:R$ 207,90:false:platinum
Escada 4 Degraus Alumínio Doméstica Mor Reforçada:36 dias:50:R$ 144,98:false:lider
Escada De Alumínio 3 Degraus Tesoura Capacidade 120 Kg Mor:14 dias:25:R$ 119,90:false:none
Escada De Alumínio 3 Degraus Tesoura Resistente 120 Kg Mor:2 dias:5:R$ 117,90:false:platinum
Escada Alumínio Doméstica 5 Degraus Mor Reforçada:21 dias:100:R$ 219,90:false:platinum
Escada De Aluminio 4 Degraus - Mor:1 dias:1:R$ 200,80:false:platinum
Escada Mor Aluminio 4 Degraus Resistente Domestica Forte:7 dias:25:R$ 157,00:false:none
Banqueta Escada Alumínio 3 Degraus Multifuncional Reforçada:36 dias:50:R$ 166,40:false:none
Escada Alumínio Doméstica 5 Degraus Mor Reforçada Resistente:25 dias:100:R$ 206,90:false:gold
