Escova Secadora Mondial Golden Rose 1200w Es-02:90 dias:1000:R$ 169,90:true:platinum
Escova Secadora Black Rose Mondial Es-05:90 dias:500:R$ 169,90:true:platinum
Escova Alisadora 5 Em 1 Temperatura Ajustavel Bivolt Origina:41 dias:100:R$ 39,00:true:gold
Escova Secadora Rotativa Pec05v Ceramic Spin Ion Brush 127v:14 dias:100:R$ 209,00:true:none
Escova Alisadora De Cabelo 3 Em 1 Eletrico Ceramico Pente:66 dias:100:R$ 41,94:true:lider
Escova Secadora Rotativa Pec05v Ceramic Spin Ion Brush 220v:14 dias:25:R$ 209,00:true:none
Escova Tourmaline Secadora Alisadora Britânia Soft Íon 1300w:84 dias:100:R$ 148,19:false:platinum
Escova De Cabelo Secadora 5 Em 1 Alisa Modela Bivolt:39 dias:50:R$ 166,90:false:none
Escova Rotativa Ceramic Spin Íon Brush Pec05v Philco 110v:12 dias:25:R$ 199,99:false:platinum
Escova Rotativa Mondial Erb01 Rose 110/220v Giratória 3 Em 1:69 dias:100:R$ 226,95:true:lider
Escova Alisadora 5 Em 1 Temperatura Ajustável Bivolt Premium:38 dias:100:R$ 79,84:true:platinum
Escova Secadora 5 Em 1 Elétrica Ar Quente Modeladora Pente:46 dias:50:R$ 154,99:false:platinum
Escova Alisadora Bivolt Com Display Digital Mondial Golden:85 dias:100:R$ 147,25:false:gold
Escova Alisadora 5 Em 1 Temperatura Ajustável Bivolt:67 dias:100:R$ 33,78:false:none
Escova Secadora 3 Em 1 Profissional C/ Óleo De Argan 1200w:18 dias:50:R$ 178,41:false:gold
Secador 5 Em 1 Escova Elétrica Modeladora Alisadora Seca Boa:37 dias:50:R$ 125,60:false:none
Escova Rotativa Philco Ceramic Ion Brush Pec05v:27 dias:50:R$ 229,99:false:gold
2audição Invisível Audição A-id Earplug Distribuidor 3 Nível:53 dias:100:R$ 106,42:false:platinum
Jogo/ Capas De Ponteiras Renegade Longarina Projecar:1 dias:1:R$ 121,45:false:gold
Lareira Lenha Área Externa Jardim Inox Fábrica:79 dias:100:R$ 89,90:false:platinum
Balança Corporal Digital Xiaomi Body Scale 2 C/biompedancia:39 dias:100:R$ 169,00:false:lider
Balança Digital Bioimpedância Corporal Bluetooth Aplicativo:86 dias:500:R$ 49,67:true:gold
Balança Corporal Digital G-tech Glass 11, Até 180 Kg:46 dias:50:R$ 64,50:true:gold
Balança Digital Xiaomi C/ Bioimpedância Scale 2 - Original:38 dias:50:R$ 239,99:false:platinum
Balança Digital Bioimpedancia Corporal Aplicativo Bluetooth:40 dias:100:R$ 52,42:true:none
Kit Reparos E Peças Compressor Wayne Wetzel Wtv 10n:1 dias:1:R$ 550,00:false:platinum
Kit Lava Jato Auto Abraçadeira + Luva + Espigão + Esguicho:1 dias:1:R$ 189,41:false:gold
Chapinha Modeladora Triondas Cachos Ondulador Cerâmica:90 dias:500:R$ 89,91:false:platinum
Cacheador Modelador Cachos Espiral Enrolar Cabelo Pro Bivolt:63 dias:100:R$ 34,66:true:gold
Modelador Curling Rod Cetim Sem Calor + 2 Scrunchies Xuxinha:35 dias:100:R$ 17,01:true:platinum
Kit 10 Unidade De Modelador Capilar 150g:1 dias:1:R$ 120,00:false:lider
Modelador De Cachos De Cetim - Kit 10 Unidades:1 dias:1:R$ 240,00:false:none
Algodão Bellacotton Quadrado Para Bebê - 6 Pacotes:60 dias:500:R$ 143,42:true:none
Algodão Bellacotton Quadrado Para Bebê - 3 Pacotes:60 dias:500:R$ 69,90:true:none
Kit Algodão Bellacotton Quadrado Para Bebê - 3 Pacotes:61 dias:100:R$ 69,90:true:none
6 Algodão Quadrado Bellacotton Sem Perfume Bebê 600 Unidades:53 dias:100:R$ 152,91:true:platinum
Algodão Bellacotton Quadrado Bebê Sem Perfume - 300 Unidades:79 dias:100:R$ 70,20:false:platinum
Aquecedor Elétrico Portátil 1400w 110v Ou 220v - Pró Euro:70 dias:500:R$ 100,72:true:none
Mini Aquecedor Ar Ambiente Eletrico Portatil 1500w Mesa Frio:71 dias:100:R$ 99,92:true:lider
Aquecedor Elétrico Portátil Termoventilador 4 Estágios -110v:71 dias:100:R$ 98,91:true:lider
Mini Aquecedor Portátil Máquina De Aquecer Turbo 800w:36 dias:50:R$ 59,90:false:none
Aquecedor Ar Elétrico Portátil De Ambiente Quarto 110/220v:84 dias:100:R$ 104,90:false:platinum
Aquecedor Britânia Ab1500p 2 Em 1 2000w:71 dias:100:R$ 149,90:false:none
Aquecedor Residencial 1.500 Watts A-08 Mondial 110v:89 dias:100:R$ 169,00:false:none
Aquecedor Elétrico Portátil Termoventilador 4 Estágios -110v:74 dias:100:R$ 115,80:true:lider
Maquina Acabamento Recarregável Cabelo Barba Sem Fio Digital:40 dias:1000:R$ 79,90:true:platinum
Máquina Profissional Dragão Acabamento Sem Fio Cabelo Barba:53 dias:1000:R$ 26,90:true:platinum
Máquina Profissional Acabamento Cabelo Barba Recarregável:35 dias:500:R$ 19,94:true:platinum
Cortador De Cabelo Mondial Stylo Hair Cr-02 Prata/preto 110v:63 dias:100:R$ 59,00:true:gold
Máquina Profissional Acabamento Cabelo Barba Recarregável:15 dias:100:R$ 24,95:true:lider
Máquina Cabelo Barba Acabamento Pezinho Recarregável Sem Fio:63 dias:500:R$ 28,43:true:lider
Máquina Profissional Acabamento Cabelo Barba Recarregável:19 dias:100:R$ 21,44:false:platinum
Maquina Acabamento Recarregável Cabelo Barba Sem Fio Premium:28 dias:100:R$ 24,77:true:gold
Máquina De Cortar Cabelo Profissional Wmark Ng-108a Original:89 dias:100:R$ 199,27:true:gold
Banco De Bateria Sonata Sd91 Reforçado Preto - Loja:46 dias:50:R$ 179,00:false:platinum
Capota Maritima Amarok 2010 2011 2012 A 2018 Cab Dupla Trek:90 dias:100:R$ 484,50:false:gold
Capota Maritima Saveiro Simples C Ganchos Track 2010 A 2023:90 dias:100:R$ 451,25:false:gold
Capota Marítima Speed Tech S10 1996 À 2011 Cabine Dupla Top:67 dias:100:R$ 467,00:false:platinum
Capota Lona Maritima Saveiro Cross Estendida 2010 2023 Trek:1 dias:1:R$ 475,00:false:gold
Adaptador Compatível Tipo C Lightning iPhone 7 8 X 11 12 13:13 dias:25:R$ 26,65:false:platinum
Carregador Celular Micro Usb V8 Turbo P/ Samsung J8 J7 J6 J5:5 dias:5:R$ 15,39:false:lider
Cabo Adaptador Tipo C Otg Pendrive Para Celular E Tablet:88 dias:100:R$ 11,04:true:lider
Bicarbonato De Sódio 1kg Puro Casa Bela:68 dias:500:R$ 16,90:true:platinum
Bicarbonato De Sódio 21 Química 5und X 1kg = 5kg:79 dias:100:R$ 52,24:false:gold
Fermento Bicarbonato De Sódio 100% Puro Fino Leve 2 Para 1kg:85 dias:100:R$ 6,49:false:none
Par Suporte Traseiro Capota Flash Force Strada Ah524:71 dias:100:R$ 59,90:false:none
Eixo Cabo Chicote Extensor Flexivel 1 Metro Micro Retifica:46 dias:50:R$ 33,55:true:none
Moldura Friso Superior Tampa Traseira Strada Fiat 100279013:1 dias:1:R$ 120,86:false:none
Kit Aquecedor Solar Boiler 400 L + 02 Placas 2,00m Classe A:1 dias:1:R$ 5.450,00:false:none
Chapinha De Cabelo Profissional 450°f Nano Titanium 110/220v:41 dias:100:R$ 54,94:true:gold
Chapinha Profissional Titânio 450°f Bivolt Envio Imediato Nf:84 dias:100:R$ 75,09:true:gold
Prancha Chapinha Progressiva Cabelo Nanotitanium 450 Graus F:84 dias:100:R$ 64,28:true:gold
Prancha Profissional Lizze Extreme Chapinha 480º+kit Limpeza:69 dias:100:R$ 476,92:false:none
Chapinha Azul Nano Titanium 230°c:50 dias:50:R$ 58,29:true:lider
Prancha Chapinha De Cabelo Profissional Titânio 450 Graus Nf:40 dias:100:R$ 74,61:true:platinum
Chapinha Prancha Profissional Nano Titanium 110/220v Full Nf:41 dias:50:R$ 54,94:true:gold
Gel Lubrificante Íntimo 250ml Red Lube Extra Thick:22 dias:25:R$ 41,81:true:lider
Gel Volumão Intensificador Masculino - Hot Flowers:70 dias:100:R$ 17,83:true:gold
Lubrificante E Hidratante Gel Intimo Natural Feel 50ml:77 dias:100:R$ 78,90:true:platinum
Lubrificante Hidratante Íntimo Feel Sem Perfume Neutro 50ml:77 dias:100:R$ 78,90:true:platinum
Hot Ball Mix Kit 4 Bolinhas Lubrificante Explosiva Sabores:74 dias:100:R$ 13,58:true:gold
Bateria Vonder Pfv012 E Pfv012i Parafusadeira Furadeira:88 dias:100:R$ 160,00:true:platinum
Bateria Lítio P/ Parafusadeira 12v Pfv012i Pfv012 Vonder:66 dias:100:R$ 126,90:false:lider
Bateria Vonder Pfv012 E Pfv012i Parafusadeira Furadeira:49 dias:50:R$ 147,25:true:platinum
Bateria P/ Parafusadeira 12v Pfv012i Pfv012 Pfv112qr Vonder:66 dias:100:R$ 126,90:false:lider
Secador De Cabelos110v Profissional Potente 4100w Promoção:84 dias:100:R$ 167,91:true:gold
Secador De Cabelos110v Profissional Potente Promoção Origina:50 dias:50:R$ 110,43:true:gold
Secador De Cabelos110v Profissional 2 Velocidade Potente:39 dias:100:R$ 103,90:false:none
Ar Condicionado LG Dual Inverter Voice Split Frio 9000 Btu:2 dias:2:R$ 1.469,30:false:none
Ar Cond Split Inverter Gree 9000 Btus Preto:1 dias:2:R$ 1.179,99:false:none
Ar Condicionado Samsung Windfree Connect Split Inverter:2 dias:2:R$ 1.724,90:false:none
Pop Suporte Celular Auto Colante Segurança Dedo Selfie Mão:22 dias:25:R$ 17,60:true:none
Aparador De Pelos Philips Nt3650 Nariz Orelhas Sobrancelhas:47 dias:100:R$ 139,90:false:none
Climatizador Portátil Ventisol Clin8-01 8 Litros 130w Branco:8 dias:25:R$ 349,00:false:none
Disco Flap Acabamento Escolha Grão 4.1/2 Zircônio Cx 20 Pçs:68 dias:100:R$ 70,90:true:lider
Disco Desbaste Diamantado Concreto Esmerilhadeira Mármore:43 dias:100:R$ 35,36:true:lider
15 Mil Cápsulas Gelatina Vazia:1 dias:1:R$ 480,00:false:none
Calota Centro De Roda F250 F350 Cromada Espelhada:22 dias:50:R$ 195,00:false:lider
Bat_ria Xiaomi (bn46) Para Redmi Note 8, Note 8t:57 dias:100:R$ 79,00:false:gold
Battria Compatível iPhone 7 7g Larcado 1960 Mah:25 dias:100:R$ 87,99:false:none
Battria Compatível iPhone 7 Plus Larcado 2900 Mah:25 dias:50:R$ 87,99:false:none
Kit Bat.ria Para iPhone 8 Plus Nova Original Frete Grátis:60 dias:100:R$ 132,99:false:gold
Battria Compatível iPhone XR Larcado 2942 Mah:25 dias:25:R$ 111,99:false:none
Battria Premium Para Galaxy A30 A30s A50 Aa20 Testada + Cola:24 dias:25:R$ 79,99:false:none
10 Jg De Carvão P/lixadeira De Parede Menegotti Mlp-750 Led:42 dias:50:R$ 66,00:false:lider
Desumidificante S39 Álcool Metílico 500ml:86 dias:100:R$ 16,99:false:platinum
Cabo Usb Carregador P/ iPhone 6 7 8 Plus S X Xr Xs 11 11pro:55 dias:100:R$ 13,12:true:gold
Cabo Samsung Micro Usb Galaxy A10 A10s A03 A02 A01 Original:75 dias:100:R$ 32,79:true:platinum
Cabo Carregador Samsung Tipo C S23+ S22 S21 S20 Fe Original:75 dias:100:R$ 35,97:true:platinum
Cabo Usb Tipo C Samsung A13 A14 A24 A34 A54 S20 Original:75 dias:100:R$ 31,13:true:platinum
Cabo Samsung Usb-c Galaxy S9 S10 A22 A32 A52 A53 Original:75 dias:100:R$ 31,13:true:platinum
Cabo iPhone Lightning 2 Metros Para iPhone Garantia Lacrado:84 dias:100:R$ 79,00:true:gold
Cabo Carregador Turbo iPhone iPad Original Reforçad 2 Metros:74 dias:500:R$ 19,99:true:none
Tripé Pedestal Profissional P/ Cabeça De Treino Cabeleireiro:41 dias:50:R$ 123,49:false:gold
Kit Zeiss Antifog Limpeza Desembaça Lentes Óculos Geral:32 dias:50:R$ 21,60:true:none
Queimador Para Lareira Ecológica Etanol 50cm Promoção:46 dias:50:R$ 147,25:false:none
Lareira Ecológica Completa Portátil Etanol/álcool Original:41 dias:50:R$ 139,65:false:none
Queimador Exclusivo Lareira Ecológica Etanol 40cm Envio 24h:46 dias:50:R$ 127,00:false:none
Lareira Ecologica De Mesa A Alcool Etanol De Posto 46cm:83 dias:100:R$ 125,00:false:none
Queimador Para Lareira Alcool 30cm Queima Sustentável Promo:1 dias:3:R$ 75,00:false:none
Capa Profissional Para Corte De Cabelo Infantil Dinossauro:1 dias:1:R$ 29,99:false:gold
Latão De Leite Plástico Injesul Cinza 10l:19 dias:25:R$ 34,90:false:platinum
Sinos De Mesa, Sinos De Mão De Metal Diatônico De 8 Notas, M:1 dias:1:R$ 169,74:false:none
Capa Cobrir Carro Forrada Impermeável Couro P M G Ecológico:60 dias:100:R$ 189,90:false:lider
Capa Cobrir Carro Impermeável Original Forrada 100% Proteção:79 dias:1000:R$ 49,79:false:platinum
Caneta Touch Screen Ideal P/ Assinatura Digital E Desenhos:77 dias:100:R$ 14,15:true:gold
Caneta Touch Screen Ponta Fina Desenho iPad iPhone Android:56 dias:100:R$ 114,21:true:none
Pontas S-pen Samsung Galaxy Tab S9 Sm-x710 S9 Plus S9 Ultra:2 dias:4:R$ 43,49:false:lider
Lupa Profissional Cabeça Aumento C/led Estetica Eletronica:60 dias:500:R$ 52,07:true:lider
Lupa Cabeça Profissional Aumento Leitura Estetica Eletronica:90 dias:100:R$ 65,48:true:gold
Capa Capinha Transparente Rígida Samsung Galaxy Z Flip 5 5g:29 dias:50:R$ 44,90:true:platinum
Capa Capinha Transparente Para Galaxy Z Flip5 5g:42 dias:500:R$ 69,99:true:gold
Capa Case +película 3d Vidro Para Samsung Galaxy A14 Premium:78 dias:500:R$ 24,99:true:gold
Capa Anti Choque Ring Xiaomi Poco F5/ F5 Pro+película Vid 9d:75 dias:100:R$ 89,99:false:gold
Capa De Vidro Com Magsafe Para iPhone 13 Tds Modelos Pro Max:50 dias:50:R$ 55,15:false:none
Capa Capinha De Vidro Para iPhone 11, 12, 13, 14 Pro Max:69 dias:1000:R$ 51,33:true:gold
Capa Carteira Couro Flip Magnética Para Galaxy A54 5g:81 dias:100:R$ 59,00:true:platinum
Capa Capinha Glass Magsafe Para iPhone 11 12 13 14 Pro Max:35 dias:50:R$ 88,90:false:lider
Lamina Para Serra Circular 9 1/4 X 40d F25 D51378 - Makita:22 dias:100:R$ 125,55:false:none
Pedal De Bateria Estudante Standard Sonata Dp100 Simples:49 dias:50:R$ 119,00:false:platinum
Pedal De Bateria Estudante Standard Sonata Dp100 Simples:49 dias:50:R$ 119,00:false:platinum
Bateira Np-bn1 P/ Sony W530 W570 Tx5 Wx70 T99 W310 W320 W350:1 dias:1:R$ 128,00:false:platinum
2 Kilos Parafina Granulada Lentilhada Kit Vela Decorativa:75 dias:100:R$ 53,37:true:platinum
Ccera De Coco Vegetal Para Velas Artesanais 1,5kg:86 dias:100:R$ 65,90:true:lider
Cera Vegetal De Coco Para Velas 1 Kg:70 dias:100:R$ 44,15:true:gold
2kg Cera Vegetal Para Velas - Cera Coco T-02 100% Natural:35 dias:50:R$ 78,90:false:lider
Kit 3 Escovas Profissionais Cabelo Cerdas De Javali:27 dias:50:R$ 78,90:false:none
Lâmina Ratinho Para Raspador Insufilm 100 Unidades:50 dias:100:R$ 99,00:false:lider
Câmera Ré Automotiva Tartaruga Infravermelho Visão Noturna:74 dias:100:R$ 37,89:true:none
Câmera De Ré Hd Automotiva Estacionamento Borboleta/embutir:24 dias:25:R$ 24,99:false:none
Capinha Contra Água - Celular Universal:4 dias:4:R$ 10,00:false:none
Pavio Para Velas Artesanais 10cm Kit Com ( 50 Unidades ):84 dias:100:R$ 21,99:true:gold
Defletor De Ar Condicionado Split Ajustável 7 A 30mil Btus:36 dias:100:R$ 57,90:true:platinum
Defletor Ar Condicionado Universal Ajustável 7 Até 30mil Btu:50 dias:100:R$ 89,89:true:platinum
Defletor Ar Condicionado Universal Ajustável 7 Até 30mil Btu:32 dias:100:R$ 89,78:true:none
Defletor Ar Condicionado Split Tamanho Ajustável 60 A 100 Cm:32 dias:100:R$ 52,90:true:platinum
Limpeza Ar Condicionado S/ Enxague 5l Metasil Metacoil:35 dias:50:R$ 39,90:false:lider
Kit 12 Grade Grelha Ventilação Redonda 150mm Tela Integrada:1 dias:1:R$ 159,90:false:none
Pastilha Bactericida Metasil Desix Tablet 70g:63 dias:100:R$ 13,00:false:lider
Calha Chuva Defletor Gol Voyage G5 G6 G7 2008 À 2022 Tg Poli:83 dias:100:R$ 111,05:false:gold
Película Privacidade Vidro 3d Xiaomi Poco X5 / X5 Pro 6.67:82 dias:100:R$ 27,53:true:lider
Película Premium Hprime Nanoshield Para Samsung Galaxy M54:77 dias:100:R$ 35,90:true:gold
Película De Vidro Curva Uv Motorola Moto Edge 30 Fusion:88 dias:100:R$ 39,49:true:lider
Película De Vidro 3d Samsung S21 S21+ S22 S22+ S23 S23+:32 dias:50:R$ 37,90:true:lider
Película Gel Hidrogel Frente & Verso+cam+ P/ Galaxy Z Flip 5:33 dias:50:R$ 48,89:true:platinum
Kit Com 5x Películas De Gel 5d Flexível Para iPhone XR / 11:69 dias:100:R$ 29,80:true:none
Película 3d Privacidade + Câmera Para Xiaomi Poco X5 Pro 5g:86 dias:100:R$ 37,99:true:gold
Controle Original Para Nintendo 64:1 dias:1:R$ 220,00:false:none
Banqueta Plástica Dobrável 45cm Preta Vonder 150kg Com Alça:90 dias:100:R$ 78,99:true:platinum
Banqueta Plástica Dobrável 22cm Preta Vonder 150kg Com Alça:90 dias:100:R$ 58,90:true:platinum
Suporte Para Serra Mármore Corte Ângulo 45 Graus:39 dias:100:R$ 79,90:false:platinum
Cabo Conector M12 P/ Sensores C/ Led 90° Pnp 4 Fios 2m:4 dias:4:R$ 36,00:false:lider
Kit Cesto Empilhavel Expositor Organizador Preto 20 Unidades:49 dias:100:R$ 258,00:false:none
Suporte De Makita Para Serra Mármore Corte Ângulo 45 Graus:26 dias:50:R$ 89,90:false:platinum
Tinta Acrílica Econômica Branco Gelo 18 Litros- Quartzolit:61 dias:500:R$ 144,63:false:none
Kit 3 Espuma Expansiva Universal Obras Janela Uso Geral:63 dias:500:R$ 39,90:false:none
Finca Pino Amarelo Magazinado Calibre 27 - Walsywa Caixa C:83 dias:500:R$ 51,48:false:platinum
Lentes De Contato Solflex Cl:28 dias:100:R$ 94,00:false:platinum
Carregador Mh-24 P/ Bat. Nikon En-el14 - D5100, D5200, D3200:39 dias:50:R$ 78,00:true:gold
Ventosa Para Remover Tirar Lentes De Contato C/ Precisão:71 dias:100:R$ 17,90:true:gold
Cortador Corte Rápido Chapas Ferro Alumínio Galvanizado Inox:13 dias:50:R$ 56,90:true:none
Cortador Corte Rápido Chapas Ferro Alumínio Galvanizado Inox:13 dias:25:R$ 55,06:false:none
Adaptador De Serra Elétrica Tico Tico Sabre Para Furadeira:14 dias:25:R$ 56,00:false:none
Lente De Contato Biofinity Com Grau - Coopervision + Brinde:1 dias:4:R$ 177,00:false:none
Lentes De Contato Colorida Gelatinosa Sem Grau 1par E Estojo:88 dias:100:R$ 38,50:false:platinum
50 Forma 3d Madeira 120x14,5 Abs 2mm Molde Para Cimento/conc:1 dias:1:R$ 3.299,99:false:gold
Kit 3 Moldes Forma Silicone Caneta Resinas Epóxi Artesanato:20 dias:25:R$ 29,91:true:gold
Carregador Turbo 68w Tipo C Para Motorola E Todos Os Samsung:56 dias:1000:R$ 66,96:true:platinum
Carregador Magnético Indução Magsafe P/ iPhone 11 12 13 14:48 dias:1000:R$ 37,90:true:platinum
Carregador Turbo 33w Para Xiaomi Redmi Note 9 10 11 12 Poco:46 dias:100:R$ 41,87:true:gold
Carregador Celular Tomada Plug Fonte Usb Bivolt:61 dias:500:R$ 9,90:true:platinum
Carregador 25w Original Max Turbo Para Samsung S20 S10 S21:85 dias:500:R$ 47,40:true:gold
Carregador Portátil Externo Powerbank 10000mah Universal Br:35 dias:100:R$ 36,60:true:none
Carregador Turbo 67w P/ Xiaomi Redmi Note 12 Pro Poco X5 Pro:46 dias:100:R$ 52,47:true:gold
Carregador Turbo Para Xiaomi Redmi Note 8 9 10 11 Poco X3:39 dias:100:R$ 79,00:true:platinum
Kit 10 Carregadores Usb Tipo C Atacado Revenda Barato C/ Nf:22 dias:25:R$ 112,00:true:gold
Carregador Samsung Turbo 45w S21 S22 S23 Note 20 Plus Ultra:31 dias:100:R$ 120,47:false:none
Carregador De Celular 68w Turbo Duo Tipo-c 10x Mais Rápido:41 dias:100:R$ 29,90:false:platinum
Carregador De Celular 50w Turbo Duo Tipo-c 8x Mais Rápido:56 dias:100:R$ 29,50:false:platinum
Carregador Para Xiaomi Turbo 33w Pro Mi Redmi Pocophone Note:35 dias:50:R$ 49,00:false:none
Carregador Usb C + Fonte Para iPhone X 11 12 13 14 Pro Max:46 dias:100:R$ 29,55:false:none
Carregador Turbo P/ Motorola Tipo C Moto G10 G9 G8 G7 30w:66 dias:100:R$ 30,50:true:platinum
Carregador Para Xaiomi Qualidade Carrega Rapido Turbo Barato:35 dias:100:R$ 79,00:true:lider
Carregador Portátil Power Bank 10.000mah Universal iPhone:54 dias:100:R$ 42,00:true:gold
Carregador Portátil 10.000 Power Bank Mah V8 E Lightning:22 dias:100:R$ 32,99:true:gold
Powerbank Fast Charge Xiaomi Redmi 20000mah 18w + Cabo Usb-c:10 dias:25:R$ 159,90:false:lider
Carregador Portátil Power Bank 20.000mah Universal Externa:43 dias:100:R$ 100,90:false:none
Carregador Turbo 67w Para Xiaomi Redmi Note 9 10 11 12 Pro:32 dias:50:R$ 79,00:true:lider
Cabo + Fonte Compatível iPhone SE X Xr 11 12 13pro 14 Usb-c:55 dias:500:R$ 16,75:false:platinum
Carregador Turbo 30w 3.0 Tipo C Para Motorola G10 G9 G8 G7:42 dias:100:R$ 26,25:true:gold
Carregador Turbo Para Xiaomi Mi 10 11 12 Pro Lite Ultra 67w:39 dias:50:R$ 65,94:true:platinum
Carregador Turbo 67w Tipo-c Para Xiaomi Todos Mi Note E Poco:43 dias:100:R$ 59,17:true:platinum
Carregador Portátil Power Bank 20000mah Universal Celular:40 dias:100:R$ 104,24:false:none
Carregador Veicular P/ iPhone Turbo Usb C 38w Cabo Lightning:54 dias:100:R$ 44,90:true:platinum
Carregador Original Samsung 25w Turbo S20 S10 S21 Plus Ultra:68 dias:100:R$ 99,92:true:lider
Carregador Portátil Powerbank 10.000mah Para iPhone Samsung:35 dias:100:R$ 41,93:true:gold
Carregador Turbo 30w Tipo C Para Motorola Xiaomi Samsung:40 dias:100:R$ 79,99:true:platinum
Power Bank 10.000 Mah Carregador Portátil V8 E Lightning:22 dias:100:R$ 32,99:true:gold
Carregador Super Turbo 125w Tipo C Para Samsung E Moto G X Z:12 dias:25:R$ 70,50:true:platinum
Carregador Sem Fio Indução iPhone Samsung Xiaomi Ultrarápido:40 dias:500:R$ 39,95:true:platinum
Carregador Rápido Automotivo Premium Dual Usb 50w Max:1 dias:1:R$ 89,90:false:gold
Carregador Portátil Power Bank 20000mah Universal Celular:56 dias:100:R$ 103,97:false:none
Máquina De Corte De Garrafa De Vidro Profissional:1 dias:1:R$ 79,20:false:gold
Kit Renu Fresh 355 + 120 Ml Solução Para Lentes De Contato:81 dias:100:R$ 52,00:true:platinum
Colírio Hyabak Hidratação E Lubrificação Kit C/ 3un De 10ml:49 dias:100:R$ 166,90:false:platinum
Kit Com 3un Soro Fisiológico Cloreto De Sódio 500ml Arboreto:90 dias:100:R$ 31,99:true:platinum
Pente Inquebravel (pente Durão) Masculino Preto Cx 24 Unid:32 dias:100:R$ 19,99:false:none
2 Pentes De Disfarce Degrade Máquina 0.5 E 1.5 Profissional:55 dias:100:R$ 23,65:true:platinum
Cartão De Memória Full Hd Para Cameras Wi-fi 64 Gb Envio Hj:44 dias:1000:R$ 29,90:true:lider
Cartão Memória Micro Sd Sandisk 32gb Ultra Classe 10:80 dias:1000:R$ 39,06:true:platinum
Cartão De Memoria 1tb Mi Xiaomi Original Com Leitor Usb:33 dias:50:R$ 99,00:false:platinum
Cartão Memória Micro Sd Sandisk 64gb Utra Classe 10:80 dias:1000:R$ 47,40:true:platinum
Cartão De Memória Sandisk Ultra Com Adaptador 64gb Micro Sd:44 dias:500:R$ 26,50:true:lider
Cartão De Memória 64gb Sandisk Extreme Pro:2 dias:4:R$ 92,90:false:lider
Kit 4 Cartão De Memoria Micro Sd 64gb Sandisk Para Camêra Ip:86 dias:100:R$ 180,57:true:gold
Cartão Memória 128gb Sandisk Micro Sd 10 Ultra - Original:84 dias:100:R$ 76,06:true:platinum
Cartão De Memória Micro Sd Kingston 64gb 100mbs Original:45 dias:100:R$ 39,92:true:gold
Jogo De Brocas Bits E Buchas Com 300 Peças Mtx:48 dias:500:R$ 37,00:true:platinum
99 Pçs Jogo Completo Brocas Lorben 1,5 A 10 Mm Aço Rápido:60 dias:100:R$ 64,20:true:none
Carregador Turbo 67w Para Xiaomi Redmi Note12 Pro Pocox5 Pro:49 dias:50:R$ 79,28:true:gold
Capa Estofada Para Cadeirinha Carro Miss Minnie, Cosmo,nania:1 dias:1:R$ 139,00:false:none
Cartão De Memória Full Hd Para Cameras Wi-fi 64 Gb Envio Hj:44 dias:1000:R$ 29,90:true:lider
Cartão Memória Micro Sd Sandisk 32gb Ultra Classe 10:80 dias:1000:R$ 39,06:true:platinum
Cartão De Memoria 1tb Mi Xiaomi Original Com Leitor Usb:33 dias:50:R$ 99,00:false:platinum
Cartão Memória Micro Sd Sandisk 64gb Utra Classe 10:80 dias:1000:R$ 47,40:true:platinum
Cartão De Memória Sandisk Ultra Com Adaptador 64gb Micro Sd:44 dias:500:R$ 26,50:true:lider
Cartão De Memória 64gb Sandisk Extreme Pro:2 dias:4:R$ 92,90:false:lider
Kit 4 Cartão De Memoria Micro Sd 64gb Sandisk Para Camêra Ip:86 dias:100:R$ 180,57:true:gold
Cartão Memória 128gb Sandisk Micro Sd 10 Ultra - Original:84 dias:100:R$ 76,06:true:platinum
Cartão De Memória Micro Sd Kingston 64gb 100mbs Original:45 dias:100:R$ 39,92:true:gold
Kit 3 Tesouras Profissionais Navalha Cabeleireiro Barbeiro:24 dias:25:R$ 101,43:true:lider
Kit 2 Tesouras Barbeiro Fio Laser E Desfiadeira Cabeleireiro:43 dias:50:R$ 38,92:true:platinum
Kit 3 Tesouras Profissionais Fio Navalha Fio Laser Desbaste:83 dias:100:R$ 106,95:true:platinum
Termostato De Encosto Para Aquecedor Boiler 32/66ºc:4 dias:25:R$ 76,99:false:gold
Braçadeira Com Manguito Para Aparelho De Pressão Aneroide:70 dias:100:R$ 27,90:true:gold
Chapas 6x99x10cm 2x60x10cm 4x80x7cm 2x80x5cm 3mm - Cristal:1 dias:1:R$ 300,00:false:gold
Kit 8 Placas Chapas Acrílico Fume Cast 57cm X 31cm 3mm:1 dias:1:R$ 388,00:false:gold
Faixa Lona Vende-se 120x60cm Personalizada:81 dias:100:R$ 32,90:false:gold
Acetato Ps Transp 58 Cm X 52,5 Cm - 2 Mm De Espessura - 2 Un:1 dias:1:R$ 69,90:false:lider
Pvc Branco 60 Cm X 50 Cm - 1 Mm De Espessura - 3 Un:1 dias:1:R$ 69,90:false:lider
Kit 2 Placas Acrílico Transparente Cristal 510mm X 225mm 2mm:1 dias:1:R$ 56,00:false:gold
Kit 24 Raquetes Pequenas + 12 Bolinhas Lembrancinhas Festas:1 dias:2:R$ 50,00:false:none
100 Touca Descartável Luxo Hospitalar Cabelo Várias Cores Nf:78 dias:100:R$ 17,58:true:none
Touca De Cetim Com Faixa Larga Conforto Antifrizz:62 dias:100:R$ 24,90:true:lider
100 Touca Descartável Tnt Branca C/ Elástica C/ Nota Anvisa:44 dias:50:R$ 14,87:true:none
Case Capa Nintendo Switch Oled Estojo C/ Película + 4 Grips:56 dias:100:R$ 78,90:true:lider
Aparelho De Pressão Pulso Digital Automático Branco G-tech:15 dias:100:R$ 78,13:true:platinum
Medidor De Pressão Arterial Pulso Omron Hem-6232t Bluetooth:62 dias:100:R$ 219,90:true:none
Aparelho Medidor De Pressão Digital Braço Omron Hem-7122:55 dias:100:R$ 194,64:false:none
Medidor De Pressao Arterial Automatico G-tech Silencioso:40 dias:50:R$ 165,51:false:platinum
Aparelho Medidor De Pressão Arterial Digital De Braço C/ Voz:35 dias:500:R$ 109,99:false:platinum
Aparelho Medidor Pressão Arterial Digital Pulso Automático:42 dias:100:R$ 109,90:false:platinum
Kit Medidor De Pressão Pulso Garantia 5 Anos+ Oxímetro Prime:76 dias:100:R$ 199,00:false:none
Chip Flex Com 20gb De Internet + Ligações + Apps Ilimitados:75 dias:100:R$ 19,99:true:gold
Esim - Estados Unidos - T-mobile - 18 Dias Ilimitado 5g Chip:1 dias:2:R$ 139,90:false:none
Chip Vivo Pré Pago Triplo Corte + Recarga Inclusa De 10 R$:5 dias:5:R$ 15,00:false:none
100 Chip Da Tim Ddd 11 Ao 99 Revenda Atacado:5 dias:5:R$ 400,00:false:none
Quadro De Avisos Animado Balão Home Office:7 dias:25:R$ 89,99:false:lider
Placa De Cortiça - Isolamento Acústico 100% Sustentável 6 Mm:33 dias:50:R$ 129,36:false:lider
Cortiça Placa Para Isolamento Térmico E Acústico Decoração:33 dias:100:R$ 39,15:false:lider
Folha De Cortiça Pura 60 X 90 ( 2,0 Mm De Espessura) -oferta:33 dias:50:R$ 33,54:false:lider
Cortiça Em Rolo 900 X 600 X 5 Mm 01 Placa:7 dias:50:R$ 89,90:false:none
Placa De Cortiça Para Mural E Painel De Fotos Quadro:7 dias:50:R$ 37,99:false:none
Quadro De Avisos Em Cortiça Formato Mosaico Hexágono 4 Pe:7 dias:25:R$ 49,99:false:none
